date,store_id,SKU,sku_name,category,units_sold,price_per_unit_usd,revenue_usd,promotion_flag,unit_of_measure,Date,price_per_unit_usd_fluctuated,price_per_unit_usd_updated
01-11-2024,Giant_Store_001,1000,Apple_Gala,Fruit,109,2.12,231.17,1,lb,2024-01-11,2.4,2.18
01-12-2024,Giant_Store_001,1000,Apple_Gala,Fruit,128,2.41,308.48,0,lb,2024-01-12,2.4,2.18
02-11-2024,Giant_Store_001,1000,Apple_Gala,Fruit,120,2.41,289.2,0,lb,2024-02-11,2.4,2.18
02-12-2024,Giant_Store_001,1000,Apple_Gala,Fruit,80,2.41,192.8,0,lb,2024-02-12,2.4,1.65
03-11-2024,Giant_Store_001,1000,Apple_Gala,Fruit,112,2.41,269.92,0,lb,2024-03-11,2.23,1.65
03-12-2024,Giant_Store_001,1000,Apple_Gala,Fruit,110,2.41,265.1,0,lb,2024-03-12,2.23,1.65
04-11-2024,Giant_Store_001,1000,Apple_Gala,Fruit,106,2.41,255.46,0,lb,2024-04-11,2.23,2.28
04-12-2024,Giant_Store_001,1000,Apple_Gala,Fruit,84,2.41,202.44,0,lb,2024-04-12,2.16,2.28
05-11-2024,Giant_Store_001,1000,Apple_Gala,Fruit,95,2.41,228.95,0,lb,2024-05-11,2.16,2.28
05-12-2024,Giant_Store_001,1000,Apple_Gala,Fruit,122,2.41,294.02,0,lb,2024-05-12,2.16,2.28
06-11-2024,Giant_Store_001,1000,Apple_Gala,Fruit,74,2.41,178.34,0,lb,2024-06-11,2.16,2.03
06-12-2024,Giant_Store_001,1000,Apple_Gala,Fruit,92,2.41,221.72,0,lb,2024-06-12,1.99,2.03
07-11-2024,Giant_Store_001,1000,Apple_Gala,Fruit,93,2.41,224.13,0,lb,2024-07-11,1.99,2.03
07-12-2024,Giant_Store_001,1000,Apple_Gala,Fruit,128,2.41,308.48,0,lb,2024-07-12,1.99,1.54
08-11-2024,Giant_Store_001,1000,Apple_Gala,Fruit,100,2.41,241.0,0,lb,2024-08-11,1.99,1.54
08-12-2024,Giant_Store_001,1000,Apple_Gala,Fruit,94,2.41,226.54,0,lb,2024-08-12,2.19,1.54
09-11-2024,Giant_Store_001,1000,Apple_Gala,Fruit,83,2.41,200.03,0,lb,2024-09-11,2.19,1.63
09-12-2024,Giant_Store_001,1000,Apple_Gala,Fruit,98,2.41,236.18,0,lb,2024-09-12,2.19,1.63
10-11-2024,Giant_Store_001,1000,Apple_Gala,Fruit,132,2.41,318.12,0,lb,2024-10-11,2.02,1.63
10-12-2024,Giant_Store_001,1000,Apple_Gala,Fruit,50,2.41,120.5,0,lb,2024-10-12,2.02,2.29
14-10-2024,Giant_Store_001,1000,Apple_Gala,Fruit,76,2.41,183.16,0,lb,2024-10-14,2.02,2.29
15-10-2024,Giant_Store_001,1000,Apple_Gala,Fruit,110,2.41,265.1,0,lb,2024-10-15,2.02,2.29
16-10-2024,Giant_Store_001,1000,Apple_Gala,Fruit,95,2.41,228.95,0,lb,2024-10-16,2.26,2.29
17-10-2024,Giant_Store_001,1000,Apple_Gala,Fruit,117,2.41,281.97,0,lb,2024-10-17,2.26,2.27
18-10-2024,Giant_Store_001,1000,Apple_Gala,Fruit,66,2.41,159.06,0,lb,2024-10-18,2.26,2.27
19-10-2024,Giant_Store_001,1000,Apple_Gala,Fruit,128,2.41,308.48,0,lb,2024-10-19,2.26,2.27
20-10-2024,Giant_Store_001,1000,Apple_Gala,Fruit,112,2.41,269.92,0,lb,2024-10-20,1.82,2.27
21-10-2024,Giant_Store_001,1000,Apple_Gala,Fruit,86,2.41,207.26,0,lb,2024-10-21,1.82,1.96
22-10-2024,Giant_Store_001,1000,Apple_Gala,Fruit,106,2.41,255.46,0,lb,2024-10-22,1.82,1.96
23-10-2024,Giant_Store_001,1000,Apple_Gala,Fruit,102,2.41,245.82,0,lb,2024-10-23,2.21,1.96
24-10-2024,Giant_Store_001,1000,Apple_Gala,Fruit,101,2.41,243.41,0,lb,2024-10-24,2.21,2.5
25-10-2024,Giant_Store_001,1000,Apple_Gala,Fruit,94,2.41,226.54,0,lb,2024-10-25,2.21,2.5
26-10-2024,Giant_Store_001,1000,Apple_Gala,Fruit,108,2.41,260.28,0,lb,2024-10-26,2.25,2.5
27-10-2024,Giant_Store_001,1000,Apple_Gala,Fruit,97,2.41,233.77,0,lb,2024-10-27,2.25,2.5
28-10-2024,Giant_Store_001,1000,Apple_Gala,Fruit,65,2.41,156.65,0,lb,2024-10-28,2.25,2.17
29-10-2024,Giant_Store_001,1000,Apple_Gala,Fruit,101,2.41,243.41,0,lb,2024-10-29,2.39,2.17
30-10-2024,Giant_Store_001,1000,Apple_Gala,Fruit,75,2.41,180.75,0,lb,2024-10-30,2.39,2.17
31-10-2024,Giant_Store_001,1000,Apple_Gala,Fruit,103,2.41,248.23,0,lb,2024-10-31,2.39,2.17
11-11-2024,Giant_Store_001,1000,Apple_Gala,Fruit,84,2.41,202.44,0,lb,2024-11-11,2.24,1.78
11-12-2024,Giant_Store_001,1000,Apple_Gala,Fruit,77,2.41,185.57,0,lb,2024-11-12,2.24,1.78
13-11-2024,Giant_Store_001,1000,Apple_Gala,Fruit,85,2.41,204.85,0,lb,2024-11-13,2.24,1.78
14-11-2024,Giant_Store_001,1000,Apple_Gala,Fruit,76,2.41,183.16,0,lb,2024-11-14,2.06,1.78
15-11-2024,Giant_Store_001,1000,Apple_Gala,Fruit,68,2.41,163.88,0,lb,2024-11-15,2.06,2.64
16-11-2024,Giant_Store_001,1000,Apple_Gala,Fruit,92,2.41,221.72,0,lb,2024-11-16,2.06,2.64
17-11-2024,Giant_Store_001,1000,Apple_Gala,Fruit,153,2.41,368.73,0,lb,2024-11-17,2.06,2.64
18-11-2024,Giant_Store_001,1000,Apple_Gala,Fruit,88,2.41,212.08,0,lb,2024-11-18,2.35,1.67
19-11-2024,Giant_Store_001,1000,Apple_Gala,Fruit,83,2.41,200.03,0,lb,2024-11-19,2.35,1.67
20-11-2024,Giant_Store_001,1000,Apple_Gala,Fruit,81,2.41,195.21,0,lb,2024-11-20,2.35,1.67
21-11-2024,Giant_Store_001,1000,Apple_Gala,Fruit,90,2.41,216.9,0,lb,2024-11-21,2.35,1.79
22-11-2024,Giant_Store_001,1000,Apple_Gala,Fruit,90,2.41,216.9,0,lb,2024-11-22,2.43,1.79
23-11-2024,Giant_Store_001,1000,Apple_Gala,Fruit,98,2.41,236.18,0,lb,2024-11-23,2.43,1.79
24-11-2024,Giant_Store_001,1000,Apple_Gala,Fruit,123,2.41,296.43,0,lb,2024-11-24,2.43,1.79
25-11-2024,Giant_Store_001,1000,Apple_Gala,Fruit,89,2.41,214.49,0,lb,2024-11-25,2.43,1.54
26-11-2024,Giant_Store_001,1000,Apple_Gala,Fruit,130,2.12,275.7,1,lb,2024-11-26,2.11,1.54
27-11-2024,Giant_Store_001,1000,Apple_Gala,Fruit,114,2.41,274.74,0,lb,2024-11-27,2.11,1.54
28-11-2024,Giant_Store_001,1000,Apple_Gala,Fruit,108,2.41,260.28,0,lb,2024-11-28,2.11,2.48
29-11-2024,Giant_Store_001,1000,Apple_Gala,Fruit,126,2.41,303.66,0,lb,2024-11-29,2.33,2.48
30-11-2024,Giant_Store_001,1000,Apple_Gala,Fruit,138,2.41,332.58,0,lb,2024-11-30,2.33,2.48
12-11-2024,Giant_Store_001,1000,Apple_Gala,Fruit,68,2.41,163.88,0,lb,2024-12-11,2.33,2.48
12-12-2024,Giant_Store_001,1000,Apple_Gala,Fruit,102,2.41,245.82,0,lb,2024-12-12,2.33,2.69
13-12-2024,Giant_Store_001,1000,Apple_Gala,Fruit,80,2.41,192.8,0,lb,2024-12-13,1.82,2.69
14-12-2024,Giant_Store_001,1000,Apple_Gala,Fruit,103,2.41,248.23,0,lb,2024-12-14,1.82,2.69
15-12-2024,Giant_Store_001,1000,Apple_Gala,Fruit,115,2.41,277.15,0,lb,2024-12-15,1.82,2.17
16-12-2024,Giant_Store_001,1000,Apple_Gala,Fruit,99,2.41,238.59,0,lb,2024-12-16,2.08,2.17
17-12-2024,Giant_Store_001,1000,Apple_Gala,Fruit,106,2.41,255.46,0,lb,2024-12-17,2.08,2.17
18-12-2024,Giant_Store_001,1000,Apple_Gala,Fruit,73,2.41,175.93,0,lb,2024-12-18,2.08,2.17
19-12-2024,Giant_Store_001,1000,Apple_Gala,Fruit,106,2.41,255.46,0,lb,2024-12-19,2.08,2.75
20-12-2024,Giant_Store_001,1000,Apple_Gala,Fruit,87,2.41,209.67,0,lb,2024-12-20,2.08,2.75
21-12-2024,Giant_Store_001,1000,Apple_Gala,Fruit,127,2.41,306.07,0,lb,2024-12-21,2.08,2.75
22-12-2024,Giant_Store_001,1000,Apple_Gala,Fruit,136,2.41,327.76,0,lb,2024-12-22,2.08,2.41
23-12-2024,Giant_Store_001,1000,Apple_Gala,Fruit,74,2.41,178.34,0,lb,2024-12-23,1.88,2.41
24-12-2024,Giant_Store_001,1000,Apple_Gala,Fruit,73,2.41,175.93,0,lb,2024-12-24,1.88,2.41
25-12-2024,Giant_Store_001,1000,Apple_Gala,Fruit,90,2.41,216.9,0,lb,2024-12-25,1.88,2.45
26-12-2024,Giant_Store_001,1000,Apple_Gala,Fruit,84,2.41,202.44,0,lb,2024-12-26,1.88,2.45
27-12-2024,Giant_Store_001,1000,Apple_Gala,Fruit,105,2.41,253.05,0,lb,2024-12-27,1.86,2.45
28-12-2024,Giant_Store_001,1000,Apple_Gala,Fruit,133,2.41,320.53,0,lb,2024-12-28,1.86,1.53
29-12-2024,Giant_Store_001,1000,Apple_Gala,Fruit,160,2.41,385.6,0,lb,2024-12-29,1.86,1.53
30-12-2024,Giant_Store_001,1000,Apple_Gala,Fruit,93,2.41,224.13,0,lb,2024-12-30,1.86,1.53
31-12-2024,Giant_Store_001,1000,Apple_Gala,Fruit,90,2.41,216.9,0,lb,2024-12-31,2.35,1.53
01-01-2025,Giant_Store_001,1000,Apple_Gala,Fruit,97,2.41,233.77,0,lb,2025-01-01,2.35,1.88
01-02-2025,Giant_Store_001,1000,Apple_Gala,Fruit,98,2.41,236.18,0,lb,2025-01-02,2.35,1.88
01-03-2025,Giant_Store_001,1000,Apple_Gala,Fruit,110,2.12,233.29,1,lb,2025-01-03,2.34,1.88
01-04-2025,Giant_Store_001,1000,Apple_Gala,Fruit,84,2.41,202.44,0,lb,2025-01-04,2.34,1.88
01-05-2025,Giant_Store_001,1000,Apple_Gala,Fruit,69,2.41,166.29,0,lb,2025-01-05,2.34,2.12
01-06-2025,Giant_Store_001,1000,Apple_Gala,Fruit,151,2.41,363.91,0,lb,2025-01-06,2.34,2.12
01-07-2025,Giant_Store_001,1000,Apple_Gala,Fruit,132,2.12,279.95,1,lb,2025-01-07,2.18,2.12
01-08-2025,Giant_Store_001,1000,Apple_Gala,Fruit,109,2.41,262.69,0,lb,2025-01-08,2.18,2.12
01-09-2025,Giant_Store_001,1000,Apple_Gala,Fruit,114,2.41,274.74,0,lb,2025-01-09,2.18,1.74
01-10-2025,Giant_Store_001,1000,Apple_Gala,Fruit,73,2.41,175.93,0,lb,2025-01-10,1.85,1.74
13-01-2025,Giant_Store_001,1000,Apple_Gala,Fruit,64,2.41,154.24,0,lb,2025-01-13,1.85,1.74
14-01-2025,Giant_Store_001,1000,Apple_Gala,Fruit,72,2.41,173.52,0,lb,2025-01-14,1.85,1.74
15-01-2025,Giant_Store_001,1000,Apple_Gala,Fruit,113,2.41,272.33,0,lb,2025-01-15,1.85,1.53
16-01-2025,Giant_Store_001,1000,Apple_Gala,Fruit,105,2.41,253.05,0,lb,2025-01-16,2.14,1.53
17-01-2025,Giant_Store_001,1000,Apple_Gala,Fruit,83,2.41,200.03,0,lb,2025-01-17,2.14,1.53
18-01-2025,Giant_Store_001,1000,Apple_Gala,Fruit,76,2.41,183.16,0,lb,2025-01-18,2.14,1.53
19-01-2025,Giant_Store_001,1000,Apple_Gala,Fruit,123,2.41,296.43,0,lb,2025-01-19,2.14,2.65
20-01-2025,Giant_Store_001,1000,Apple_Gala,Fruit,78,2.41,187.98,0,lb,2025-01-20,2.27,2.65
21-01-2025,Giant_Store_001,1000,Apple_Gala,Fruit,127,2.12,269.34,1,lb,2025-01-21,2.27,2.65
22-01-2025,Giant_Store_001,1000,Apple_Gala,Fruit,81,2.41,195.21,0,lb,2025-01-22,2.27,1.9
23-01-2025,Giant_Store_001,1000,Apple_Gala,Fruit,88,2.41,212.08,0,lb,2025-01-23,2.27,1.9
24-01-2025,Giant_Store_001,1000,Apple_Gala,Fruit,88,2.12,186.63,1,lb,2025-01-24,2.29,1.9
25-01-2025,Giant_Store_001,1000,Apple_Gala,Fruit,154,2.41,371.14,0,lb,2025-01-25,2.29,1.9
26-01-2025,Giant_Store_001,1000,Apple_Gala,Fruit,116,2.41,279.56,0,lb,2025-01-26,2.29,2.5
27-01-2025,Giant_Store_001,1000,Apple_Gala,Fruit,93,2.41,224.13,0,lb,2025-01-27,2.29,2.5
28-01-2025,Giant_Store_001,1000,Apple_Gala,Fruit,130,2.12,275.7,1,lb,2025-01-28,2.25,2.5
29-01-2025,Giant_Store_001,1000,Apple_Gala,Fruit,60,2.41,144.6,0,lb,2025-01-29,2.25,2.5
30-01-2025,Giant_Store_001,1000,Apple_Gala,Fruit,110,2.41,265.1,0,lb,2025-01-30,2.25,2.58
31-01-2025,Giant_Store_001,1000,Apple_Gala,Fruit,88,2.41,212.08,0,lb,2025-01-31,2.25,2.58
02-01-2025,Giant_Store_001,1000,Apple_Gala,Fruit,112,2.41,269.92,0,lb,2025-02-01,1.89,2.58
02-02-2025,Giant_Store_001,1000,Apple_Gala,Fruit,122,2.41,294.02,0,lb,2025-02-02,1.89,2.41
02-03-2025,Giant_Store_001,1000,Apple_Gala,Fruit,136,2.41,327.76,0,lb,2025-02-03,1.89,2.41
02-04-2025,Giant_Store_001,1000,Apple_Gala,Fruit,91,2.41,219.31,0,lb,2025-02-04,1.89,2.41
02-05-2025,Giant_Store_001,1000,Apple_Gala,Fruit,119,2.41,286.79,0,lb,2025-02-05,1.93,1.69
02-06-2025,Giant_Store_001,1000,Apple_Gala,Fruit,102,2.41,245.82,0,lb,2025-02-06,1.93,1.69
02-07-2025,Giant_Store_001,1000,Apple_Gala,Fruit,121,2.41,291.61,0,lb,2025-02-07,1.93,1.69
02-08-2025,Giant_Store_001,1000,Apple_Gala,Fruit,174,2.12,369.02,1,lb,2025-02-08,1.93,1.7
02-09-2025,Giant_Store_001,1000,Apple_Gala,Fruit,112,2.12,237.53,1,lb,2025-02-09,2.23,1.7
02-10-2025,Giant_Store_001,1000,Apple_Gala,Fruit,72,2.41,173.52,0,lb,2025-02-10,2.23,1.7
13-02-2025,Giant_Store_001,1000,Apple_Gala,Fruit,79,2.41,190.39,0,lb,2025-02-13,2.23,2.75
14-02-2025,Giant_Store_001,1000,Apple_Gala,Fruit,86,2.41,207.26,0,lb,2025-02-14,1.94,2.75
15-02-2025,Giant_Store_001,1000,Apple_Gala,Fruit,102,2.41,245.82,0,lb,2025-02-15,1.94,2.75
16-02-2025,Giant_Store_001,1000,Apple_Gala,Fruit,136,2.41,327.76,0,lb,2025-02-16,1.94,2.75
17-02-2025,Giant_Store_001,1000,Apple_Gala,Fruit,85,2.41,204.85,0,lb,2025-02-17,1.94,2.66
18-02-2025,Giant_Store_001,1000,Apple_Gala,Fruit,134,2.12,284.19,1,lb,2025-02-18,2.39,2.66
19-02-2025,Giant_Store_001,1000,Apple_Gala,Fruit,143,2.41,344.63,0,lb,2025-02-19,2.39,2.66
20-02-2025,Giant_Store_001,1000,Apple_Gala,Fruit,92,2.41,221.72,0,lb,2025-02-20,2.39,1.56
21-02-2025,Giant_Store_001,1000,Apple_Gala,Fruit,96,2.41,231.36,0,lb,2025-02-21,2.16,1.56
22-02-2025,Giant_Store_001,1000,Apple_Gala,Fruit,132,2.41,318.12,0,lb,2025-02-22,2.16,1.56
23-02-2025,Giant_Store_001,1000,Apple_Gala,Fruit,92,2.41,221.72,0,lb,2025-02-23,2.16,1.56
24-02-2025,Giant_Store_001,1000,Apple_Gala,Fruit,94,2.41,226.54,0,lb,2025-02-24,2.02,2.55
25-02-2025,Giant_Store_001,1000,Apple_Gala,Fruit,109,2.41,262.69,0,lb,2025-02-25,2.02,2.55
26-02-2025,Giant_Store_001,1000,Apple_Gala,Fruit,98,2.41,236.18,0,lb,2025-02-26,2.02,2.55
27-02-2025,Giant_Store_001,1000,Apple_Gala,Fruit,76,2.41,183.16,0,lb,2025-02-27,1.81,2.55
28-02-2025,Giant_Store_001,1000,Apple_Gala,Fruit,79,2.41,190.39,0,lb,2025-02-28,1.81,2.23
03-01-2025,Giant_Store_001,1000,Apple_Gala,Fruit,68,2.41,163.88,0,lb,2025-03-01,1.81,2.23
03-02-2025,Giant_Store_001,1000,Apple_Gala,Fruit,69,2.41,166.29,0,lb,2025-03-02,1.81,2.23
03-03-2025,Giant_Store_001,1000,Apple_Gala,Fruit,72,2.41,173.52,0,lb,2025-03-03,2.41,2.23
03-04-2025,Giant_Store_001,1000,Apple_Gala,Fruit,71,2.41,171.11,0,lb,2025-03-04,2.41,1.5
03-05-2025,Giant_Store_001,1000,Apple_Gala,Fruit,83,2.41,200.03,0,lb,2025-03-05,2.41,1.5
03-06-2025,Giant_Store_001,1000,Apple_Gala,Fruit,122,2.41,294.02,0,lb,2025-03-06,2.41,1.5
03-07-2025,Giant_Store_001,1000,Apple_Gala,Fruit,90,2.41,216.9,0,lb,2025-03-07,2.0,1.5
03-08-2025,Giant_Store_001,1000,Apple_Gala,Fruit,106,2.41,255.46,0,lb,2025-03-08,2.0,2.23
03-09-2025,Giant_Store_001,1000,Apple_Gala,Fruit,118,2.41,284.38,0,lb,2025-03-09,2.0,2.23
03-10-2025,Giant_Store_001,1000,Apple_Gala,Fruit,81,2.41,195.21,0,lb,2025-03-10,2.0,2.23
13-03-2025,Giant_Store_001,1000,Apple_Gala,Fruit,103,2.41,248.23,0,lb,2025-03-13,2.0,2.33
14-03-2025,Giant_Store_001,1000,Apple_Gala,Fruit,72,2.41,173.52,0,lb,2025-03-14,2.0,2.33
15-03-2025,Giant_Store_001,1000,Apple_Gala,Fruit,126,2.41,303.66,0,lb,2025-03-15,2.0,2.33
16-03-2025,Giant_Store_001,1000,Apple_Gala,Fruit,67,2.41,161.47,0,lb,2025-03-16,1.91,2.33
17-03-2025,Giant_Store_001,1000,Apple_Gala,Fruit,81,2.41,195.21,0,lb,2025-03-17,1.91,1.52
18-03-2025,Giant_Store_001,1000,Apple_Gala,Fruit,116,2.12,246.01,1,lb,2025-03-18,1.91,1.52
19-03-2025,Giant_Store_001,1000,Apple_Gala,Fruit,84,2.41,202.44,0,lb,2025-03-19,1.91,1.52
20-03-2025,Giant_Store_001,1000,Apple_Gala,Fruit,107,2.41,257.87,0,lb,2025-03-20,2.43,2.19
21-03-2025,Giant_Store_001,1000,Apple_Gala,Fruit,69,2.41,166.29,0,lb,2025-03-21,2.43,2.19
22-03-2025,Giant_Store_001,1000,Apple_Gala,Fruit,44,2.41,106.04,0,lb,2025-03-22,2.43,2.19
23-03-2025,Giant_Store_001,1000,Apple_Gala,Fruit,136,2.41,327.76,0,lb,2025-03-23,2.43,2.19
24-03-2025,Giant_Store_001,1000,Apple_Gala,Fruit,126,2.41,303.66,0,lb,2025-03-24,2.27,2.41
25-03-2025,Giant_Store_001,1000,Apple_Gala,Fruit,85,2.41,204.85,0,lb,2025-03-25,2.27,2.41
26-03-2025,Giant_Store_001,1000,Apple_Gala,Fruit,95,2.41,228.95,0,lb,2025-03-26,2.27,2.41
27-03-2025,Giant_Store_001,1000,Apple_Gala,Fruit,96,2.41,231.36,0,lb,2025-03-27,1.84,2.41
28-03-2025,Giant_Store_001,1000,Apple_Gala,Fruit,118,2.41,284.38,0,lb,2025-03-28,1.84,2.09
29-03-2025,Giant_Store_001,1000,Apple_Gala,Fruit,131,2.41,315.71,0,lb,2025-03-29,1.84,2.09
30-03-2025,Giant_Store_001,1000,Apple_Gala,Fruit,123,2.41,296.43,0,lb,2025-03-30,2.07,2.09
31-03-2025,Giant_Store_001,1000,Apple_Gala,Fruit,67,2.41,161.47,0,lb,2025-03-31,2.07,2.09
04-01-2025,Giant_Store_001,1000,Apple_Gala,Fruit,113,2.41,272.33,0,lb,2025-04-01,2.07,1.7
04-02-2025,Giant_Store_001,1000,Apple_Gala,Fruit,58,2.41,139.78,0,lb,2025-04-02,2.15,1.7
04-03-2025,Giant_Store_001,1000,Apple_Gala,Fruit,111,2.41,267.51,0,lb,2025-04-03,2.15,1.7
04-04-2025,Giant_Store_001,1000,Apple_Gala,Fruit,95,2.41,228.95,0,lb,2025-04-04,2.15,2.72
04-05-2025,Giant_Store_001,1000,Apple_Gala,Fruit,148,2.41,356.68,0,lb,2025-04-05,1.94,2.72
04-06-2025,Giant_Store_001,1000,Apple_Gala,Fruit,116,2.41,279.56,0,lb,2025-04-06,1.94,2.72
04-07-2025,Giant_Store_001,1000,Apple_Gala,Fruit,115,2.41,277.15,0,lb,2025-04-07,1.94,2.12
04-08-2025,Giant_Store_001,1000,Apple_Gala,Fruit,94,2.41,226.54,0,lb,2025-04-08,2.42,2.12
04-09-2025,Giant_Store_001,1000,Apple_Gala,Fruit,99,2.41,238.59,0,lb,2025-04-09,2.42,2.12
04-10-2025,Giant_Store_001,1000,Apple_Gala,Fruit,136,2.41,327.76,0,lb,2025-04-10,2.42,2.12
13-04-2025,Giant_Store_001,1000,Apple_Gala,Fruit,128,2.41,308.48,0,lb,2025-04-13,2.36,2.55
14-04-2025,Giant_Store_001,1000,Apple_Gala,Fruit,82,2.41,197.62,0,lb,2025-04-14,2.36,2.55
15-04-2025,Giant_Store_001,1000,Apple_Gala,Fruit,50,2.41,120.5,0,lb,2025-04-15,2.36,2.55
16-04-2025,Giant_Store_001,1000,Apple_Gala,Fruit,113,2.41,272.33,0,lb,2025-04-16,2.36,1.53
17-04-2025,Giant_Store_001,1000,Apple_Gala,Fruit,86,2.41,207.26,0,lb,2025-04-17,1.83,1.53
18-04-2025,Giant_Store_001,1000,Apple_Gala,Fruit,86,2.41,207.26,0,lb,2025-04-18,1.83,1.53
19-04-2025,Giant_Store_001,1000,Apple_Gala,Fruit,111,2.41,267.51,0,lb,2025-04-19,1.83,1.53
20-04-2025,Giant_Store_001,1000,Apple_Gala,Fruit,131,2.41,315.71,0,lb,2025-04-20,2.22,2.06
21-04-2025,Giant_Store_001,1000,Apple_Gala,Fruit,99,2.12,209.96,1,lb,2025-04-21,2.22,2.06
22-04-2025,Giant_Store_001,1000,Apple_Gala,Fruit,79,2.41,190.39,0,lb,2025-04-22,2.22,2.06
23-04-2025,Giant_Store_001,1000,Apple_Gala,Fruit,75,2.41,180.75,0,lb,2025-04-23,2.22,1.83
24-04-2025,Giant_Store_001,1000,Apple_Gala,Fruit,114,2.41,274.74,0,lb,2025-04-24,2.4,1.83
25-04-2025,Giant_Store_001,1000,Apple_Gala,Fruit,79,2.41,190.39,0,lb,2025-04-25,2.4,1.83
26-04-2025,Giant_Store_001,1000,Apple_Gala,Fruit,110,2.41,265.1,0,lb,2025-04-26,2.4,1.83
27-04-2025,Giant_Store_001,1000,Apple_Gala,Fruit,101,2.41,243.41,0,lb,2025-04-27,2.4,2.22
28-04-2025,Giant_Store_001,1000,Apple_Gala,Fruit,98,2.41,236.18,0,lb,2025-04-28,2.4,2.22
29-04-2025,Giant_Store_001,1000,Apple_Gala,Fruit,73,2.41,175.93,0,lb,2025-04-29,2.4,2.22
30-04-2025,Giant_Store_001,1000,Apple_Gala,Fruit,77,2.41,185.57,0,lb,2025-04-30,2.4,2.22
05-01-2025,Giant_Store_001,1000,Apple_Gala,Fruit,81,2.41,195.21,0,lb,2025-05-01,2.35,2.04
05-02-2025,Giant_Store_001,1000,Apple_Gala,Fruit,120,2.41,289.2,0,lb,2025-05-02,2.35,2.04
05-03-2025,Giant_Store_001,1000,Apple_Gala,Fruit,73,2.41,175.93,0,lb,2025-05-03,2.35,2.04
05-04-2025,Giant_Store_001,1000,Apple_Gala,Fruit,109,2.41,262.69,0,lb,2025-05-04,2.35,2.66
05-05-2025,Giant_Store_001,1000,Apple_Gala,Fruit,62,2.41,149.42,0,lb,2025-05-05,2.25,2.66
05-06-2025,Giant_Store_001,1000,Apple_Gala,Fruit,107,2.41,257.87,0,lb,2025-05-06,2.25,2.66
05-07-2025,Giant_Store_001,1000,Apple_Gala,Fruit,132,2.41,318.12,0,lb,2025-05-07,2.25,2.66
05-08-2025,Giant_Store_001,1000,Apple_Gala,Fruit,133,2.41,320.53,0,lb,2025-05-08,1.95,1.56
05-09-2025,Giant_Store_001,1000,Apple_Gala,Fruit,89,2.41,214.49,0,lb,2025-05-09,1.95,1.56
05-10-2025,Giant_Store_001,1000,Apple_Gala,Fruit,135,2.41,325.35,0,lb,2025-05-10,1.95,1.56
13-05-2025,Giant_Store_001,1000,Apple_Gala,Fruit,83,2.41,200.03,0,lb,2025-05-13,2.09,2.17
14-05-2025,Giant_Store_001,1000,Apple_Gala,Fruit,93,2.41,224.13,0,lb,2025-05-14,2.09,2.17
15-05-2025,Giant_Store_001,1000,Apple_Gala,Fruit,104,2.41,250.64,0,lb,2025-05-15,2.09,2.17
16-05-2025,Giant_Store_001,1000,Apple_Gala,Fruit,68,2.41,163.88,0,lb,2025-05-16,1.81,2.17
17-05-2025,Giant_Store_001,1000,Apple_Gala,Fruit,100,2.41,241.0,0,lb,2025-05-17,1.81,2.04
18-05-2025,Giant_Store_001,1000,Apple_Gala,Fruit,95,2.41,228.95,0,lb,2025-05-18,1.81,2.04
19-05-2025,Giant_Store_001,1000,Apple_Gala,Fruit,80,2.41,192.8,0,lb,2025-05-19,1.81,2.04
20-05-2025,Giant_Store_001,1000,Apple_Gala,Fruit,90,2.41,216.9,0,lb,2025-05-20,2.02,2.37
21-05-2025,Giant_Store_001,1000,Apple_Gala,Fruit,84,2.41,202.44,0,lb,2025-05-21,2.02,2.37
22-05-2025,Giant_Store_001,1000,Apple_Gala,Fruit,106,2.41,255.46,0,lb,2025-05-22,2.02,2.37
23-05-2025,Giant_Store_001,1000,Apple_Gala,Fruit,81,2.41,195.21,0,lb,2025-05-23,2.02,2.41
24-05-2025,Giant_Store_001,1000,Apple_Gala,Fruit,122,2.41,294.02,0,lb,2025-05-24,2.2,2.41
25-05-2025,Giant_Store_001,1000,Apple_Gala,Fruit,141,2.41,339.81,0,lb,2025-05-25,2.2,2.41
26-05-2025,Giant_Store_001,1000,Apple_Gala,Fruit,100,2.41,241.0,0,lb,2025-05-26,2.2,2.61
27-05-2025,Giant_Store_001,1000,Apple_Gala,Fruit,110,2.41,265.1,0,lb,2025-05-27,1.81,2.61
28-05-2025,Giant_Store_001,1000,Apple_Gala,Fruit,94,2.41,226.54,0,lb,2025-05-28,1.81,2.61
29-05-2025,Giant_Store_001,1000,Apple_Gala,Fruit,91,2.41,219.31,0,lb,2025-05-29,1.81,2.75
30-05-2025,Giant_Store_001,1000,Apple_Gala,Fruit,76,2.41,183.16,0,lb,2025-05-30,1.81,2.75
31-05-2025,Giant_Store_001,1000,Apple_Gala,Fruit,116,2.41,279.56,0,lb,2025-05-31,1.84,2.75
06-01-2025,Giant_Store_001,1000,Apple_Gala,Fruit,61,2.41,147.01,0,lb,2025-06-01,1.84,1.52
06-02-2025,Giant_Store_001,1000,Apple_Gala,Fruit,107,2.12,226.93,1,lb,2025-06-02,1.84,1.52
06-03-2025,Giant_Store_001,1000,Apple_Gala,Fruit,112,2.41,269.92,0,lb,2025-06-03,1.84,1.52
06-04-2025,Giant_Store_001,1000,Apple_Gala,Fruit,110,2.41,265.1,0,lb,2025-06-04,2.38,1.52
06-05-2025,Giant_Store_001,1000,Apple_Gala,Fruit,93,2.41,224.13,0,lb,2025-06-05,2.38,2.2
06-06-2025,Giant_Store_001,1000,Apple_Gala,Fruit,95,2.41,228.95,0,lb,2025-06-06,2.38,2.2
06-07-2025,Giant_Store_001,1000,Apple_Gala,Fruit,110,2.41,265.1,0,lb,2025-06-07,2.03,2.2
06-08-2025,Giant_Store_001,1000,Apple_Gala,Fruit,95,2.41,228.95,0,lb,2025-06-08,2.03,2.53
06-09-2025,Giant_Store_001,1000,Apple_Gala,Fruit,120,2.41,289.2,0,lb,2025-06-09,2.03,2.53
06-10-2025,Giant_Store_001,1000,Apple_Gala,Fruit,84,2.41,202.44,0,lb,2025-06-10,2.22,2.53
13-06-2025,Giant_Store_001,1000,Apple_Gala,Fruit,106,2.41,255.46,0,lb,2025-06-13,2.22,1.65
14-06-2025,Giant_Store_001,1000,Apple_Gala,Fruit,139,2.41,334.99,0,lb,2025-06-14,2.22,1.65
15-06-2025,Giant_Store_001,1000,Apple_Gala,Fruit,100,2.41,241.0,0,lb,2025-06-15,1.83,1.65
16-06-2025,Giant_Store_001,1000,Apple_Gala,Fruit,108,2.12,229.05,1,lb,2025-06-16,1.83,1.62
17-06-2025,Giant_Store_001,1000,Apple_Gala,Fruit,64,2.41,154.24,0,lb,2025-06-17,1.83,1.62
18-06-2025,Giant_Store_001,1000,Apple_Gala,Fruit,114,2.41,274.74,0,lb,2025-06-18,2.16,1.62
19-06-2025,Giant_Store_001,1000,Apple_Gala,Fruit,81,2.41,195.21,0,lb,2025-06-19,2.16,1.62
20-06-2025,Giant_Store_001,1000,Apple_Gala,Fruit,82,2.41,197.62,0,lb,2025-06-20,2.16,2.61
21-06-2025,Giant_Store_001,1000,Apple_Gala,Fruit,133,2.41,320.53,0,lb,2025-06-21,1.88,2.61
22-06-2025,Giant_Store_001,1000,Apple_Gala,Fruit,177,2.41,426.57,0,lb,2025-06-22,1.88,2.61
23-06-2025,Giant_Store_001,1000,Apple_Gala,Fruit,108,2.41,260.28,0,lb,2025-06-23,1.88,2.16
24-06-2025,Giant_Store_001,1000,Apple_Gala,Fruit,90,2.41,216.9,0,lb,2025-06-24,1.82,2.16
25-06-2025,Giant_Store_001,1000,Apple_Gala,Fruit,103,2.41,248.23,0,lb,2025-06-25,1.82,2.16
26-06-2025,Giant_Store_001,1000,Apple_Gala,Fruit,105,2.41,253.05,0,lb,2025-06-26,1.82,2.16
27-06-2025,Giant_Store_001,1000,Apple_Gala,Fruit,99,2.41,238.59,0,lb,2025-06-27,2.32,2.04
28-06-2025,Giant_Store_001,1000,Apple_Gala,Fruit,133,2.41,320.53,0,lb,2025-06-28,2.32,2.04
29-06-2025,Giant_Store_001,1000,Apple_Gala,Fruit,151,2.41,363.91,0,lb,2025-06-29,2.32,2.04
30-06-2025,Giant_Store_001,1000,Apple_Gala,Fruit,113,2.41,272.33,0,lb,2025-06-30,2.32,1.68
07-01-2025,Giant_Store_001,1000,Apple_Gala,Fruit,87,2.41,209.67,0,lb,2025-07-01,2.17,1.68
07-02-2025,Giant_Store_001,1000,Apple_Gala,Fruit,65,2.41,156.65,0,lb,2025-07-02,2.17,1.68
07-03-2025,Giant_Store_001,1000,Apple_Gala,Fruit,132,2.12,279.95,1,lb,2025-07-03,2.17,1.68
07-04-2025,Giant_Store_001,1000,Apple_Gala,Fruit,121,2.41,291.61,0,lb,2025-07-04,2.17,2.63
07-05-2025,Giant_Store_001,1000,Apple_Gala,Fruit,107,2.41,257.87,0,lb,2025-07-05,1.88,2.63
07-06-2025,Giant_Store_001,1000,Apple_Gala,Fruit,87,2.41,209.67,0,lb,2025-07-06,1.88,2.63
07-07-2025,Giant_Store_001,1000,Apple_Gala,Fruit,63,2.41,151.83,0,lb,2025-07-07,1.88,1.94
07-08-2025,Giant_Store_001,1000,Apple_Gala,Fruit,81,2.41,195.21,0,lb,2025-07-08,1.88,1.94
07-09-2025,Giant_Store_001,1000,Apple_Gala,Fruit,130,2.41,313.3,0,lb,2025-07-09,2.39,1.94
07-10-2025,Giant_Store_001,1000,Apple_Gala,Fruit,94,2.41,226.54,0,lb,2025-07-10,2.39,1.94
13-07-2025,Giant_Store_001,1000,Apple_Gala,Fruit,97,2.41,233.77,0,lb,2025-07-13,2.39,2.03
14-07-2025,Giant_Store_001,1000,Apple_Gala,Fruit,115,2.41,277.15,0,lb,2025-07-14,2.39,2.03
15-07-2025,Giant_Store_001,1000,Apple_Gala,Fruit,93,2.41,224.13,0,lb,2025-07-15,2.08,2.03
16-07-2025,Giant_Store_001,1000,Apple_Gala,Fruit,80,2.41,192.8,0,lb,2025-07-16,2.08,2.03
17-07-2025,Giant_Store_001,1000,Apple_Gala,Fruit,107,2.41,257.87,0,lb,2025-07-17,2.08,1.55
18-07-2025,Giant_Store_001,1000,Apple_Gala,Fruit,121,2.41,291.61,0,lb,2025-07-18,2.35,1.55
19-07-2025,Giant_Store_001,1000,Apple_Gala,Fruit,176,2.12,373.26,1,lb,2025-07-19,2.35,1.55
20-07-2025,Giant_Store_001,1000,Apple_Gala,Fruit,141,2.41,339.81,0,lb,2025-07-20,2.35,1.73
21-07-2025,Giant_Store_001,1000,Apple_Gala,Fruit,110,2.41,265.1,0,lb,2025-07-21,1.94,1.73
22-07-2025,Giant_Store_001,1000,Apple_Gala,Fruit,138,2.41,332.58,0,lb,2025-07-22,1.94,1.73
23-07-2025,Giant_Store_001,1000,Apple_Gala,Fruit,87,2.41,209.67,0,lb,2025-07-23,1.94,1.73
24-07-2025,Giant_Store_001,1000,Apple_Gala,Fruit,116,2.41,279.56,0,lb,2025-07-24,2.42,1.54
25-07-2025,Giant_Store_001,1000,Apple_Gala,Fruit,123,2.41,296.43,0,lb,2025-07-25,2.42,1.54
26-07-2025,Giant_Store_001,1000,Apple_Gala,Fruit,148,2.41,356.68,0,lb,2025-07-26,2.42,1.54
27-07-2025,Giant_Store_001,1000,Apple_Gala,Fruit,126,2.41,303.66,0,lb,2025-07-27,1.87,1.54
28-07-2025,Giant_Store_001,1000,Apple_Gala,Fruit,113,2.41,272.33,0,lb,2025-07-28,1.87,2.03
29-07-2025,Giant_Store_001,1000,Apple_Gala,Fruit,143,2.41,344.63,0,lb,2025-07-29,1.87,2.03
30-07-2025,Giant_Store_001,1000,Apple_Gala,Fruit,68,2.41,163.88,0,lb,2025-07-30,1.83,2.03
31-07-2025,Giant_Store_001,1000,Apple_Gala,Fruit,93,2.41,224.13,0,lb,2025-07-31,1.83,2.48
08-01-2025,Giant_Store_001,1000,Apple_Gala,Fruit,88,2.41,212.08,0,lb,2025-08-01,1.83,2.48
08-02-2025,Giant_Store_001,1000,Apple_Gala,Fruit,106,2.41,255.46,0,lb,2025-08-02,1.83,2.48
08-03-2025,Giant_Store_001,1000,Apple_Gala,Fruit,112,2.41,269.92,0,lb,2025-08-03,2.06,2.47
08-04-2025,Giant_Store_001,1000,Apple_Gala,Fruit,78,2.41,187.98,0,lb,2025-08-04,2.06,2.47
08-05-2025,Giant_Store_001,1000,Apple_Gala,Fruit,89,2.41,214.49,0,lb,2025-08-05,2.06,2.47
08-06-2025,Giant_Store_001,1000,Apple_Gala,Fruit,152,2.41,366.32,0,lb,2025-08-06,2.06,2.47
08-07-2025,Giant_Store_001,1000,Apple_Gala,Fruit,97,2.41,233.77,0,lb,2025-08-07,1.8,1.86
08-08-2025,Giant_Store_001,1000,Apple_Gala,Fruit,114,2.41,274.74,0,lb,2025-08-08,1.8,1.86
08-09-2025,Giant_Store_001,1000,Apple_Gala,Fruit,66,2.41,159.06,0,lb,2025-08-09,1.8,1.86
08-10-2025,Giant_Store_001,1000,Apple_Gala,Fruit,120,2.41,289.2,0,lb,2025-08-10,1.8,1.86
13-08-2025,Giant_Store_001,1000,Apple_Gala,Fruit,72,2.41,173.52,0,lb,2025-08-13,1.86,2.52
14-08-2025,Giant_Store_001,1000,Apple_Gala,Fruit,115,2.41,277.15,0,lb,2025-08-14,1.86,2.52
15-08-2025,Giant_Store_001,1000,Apple_Gala,Fruit,110,2.41,265.1,0,lb,2025-08-15,1.86,2.52
16-08-2025,Giant_Store_001,1000,Apple_Gala,Fruit,177,2.41,426.57,0,lb,2025-08-16,2.39,2.52
17-08-2025,Giant_Store_001,1000,Apple_Gala,Fruit,93,2.41,224.13,0,lb,2025-08-17,2.39,1.83
18-08-2025,Giant_Store_001,1000,Apple_Gala,Fruit,90,2.41,216.9,0,lb,2025-08-18,2.39,1.83
19-08-2025,Giant_Store_001,1000,Apple_Gala,Fruit,105,2.41,253.05,0,lb,2025-08-19,2.39,1.83
20-08-2025,Giant_Store_001,1000,Apple_Gala,Fruit,69,2.41,166.29,0,lb,2025-08-20,2.18,1.83
21-08-2025,Giant_Store_001,1000,Apple_Gala,Fruit,90,2.41,216.9,0,lb,2025-08-21,2.18,2.05
22-08-2025,Giant_Store_001,1000,Apple_Gala,Fruit,136,2.41,327.76,0,lb,2025-08-22,2.18,2.05
23-08-2025,Giant_Store_001,1000,Apple_Gala,Fruit,130,2.41,313.3,0,lb,2025-08-23,2.18,2.05
24-08-2025,Giant_Store_001,1000,Apple_Gala,Fruit,150,2.41,361.5,0,lb,2025-08-24,2.14,2.24
25-08-2025,Giant_Store_001,1000,Apple_Gala,Fruit,123,2.41,296.43,0,lb,2025-08-25,2.14,2.24
26-08-2025,Giant_Store_001,1000,Apple_Gala,Fruit,117,2.41,281.97,0,lb,2025-08-26,2.14,2.24
27-08-2025,Giant_Store_001,1000,Apple_Gala,Fruit,87,2.41,209.67,0,lb,2025-08-27,2.14,2.24
28-08-2025,Giant_Store_001,1000,Apple_Gala,Fruit,106,2.41,255.46,0,lb,2025-08-28,2.2,1.89
29-08-2025,Giant_Store_001,1000,Apple_Gala,Fruit,86,2.41,207.26,0,lb,2025-08-29,2.2,1.89
30-08-2025,Giant_Store_001,1000,Apple_Gala,Fruit,132,2.41,318.12,0,lb,2025-08-30,2.2,1.89
31-08-2025,Giant_Store_001,1000,Apple_Gala,Fruit,189,2.41,455.49,0,lb,2025-08-31,2.14,1.89
09-01-2025,Giant_Store_001,1000,Apple_Gala,Fruit,96,2.41,231.36,0,lb,2025-09-01,2.14,1.91
09-02-2025,Giant_Store_001,1000,Apple_Gala,Fruit,117,2.41,281.97,0,lb,2025-09-02,2.14,1.91
09-03-2025,Giant_Store_001,1000,Apple_Gala,Fruit,152,2.41,366.32,0,lb,2025-09-03,2.14,1.91
09-04-2025,Giant_Store_001,1000,Apple_Gala,Fruit,71,2.41,171.11,0,lb,2025-09-04,2.03,1.55
09-05-2025,Giant_Store_001,1000,Apple_Gala,Fruit,116,2.41,279.56,0,lb,2025-09-05,2.03,1.55
09-06-2025,Giant_Store_001,1000,Apple_Gala,Fruit,71,2.41,171.11,0,lb,2025-09-06,2.03,1.55
09-07-2025,Giant_Store_001,1000,Apple_Gala,Fruit,134,2.41,322.94,0,lb,2025-09-07,2.03,1.55
09-08-2025,Giant_Store_001,1000,Apple_Gala,Fruit,147,2.41,354.27,0,lb,2025-09-08,1.99,2.3
09-09-2025,Giant_Store_001,1000,Apple_Gala,Fruit,86,2.41,207.26,0,lb,2025-09-09,1.99,2.3
09-10-2025,Giant_Store_001,1000,Apple_Gala,Fruit,117,2.41,281.97,0,lb,2025-09-10,1.99,2.3
13-09-2025,Giant_Store_001,1000,Apple_Gala,Fruit,144,2.12,305.4,1,lb,2025-09-13,1.95,2.3
14-09-2025,Giant_Store_001,1000,Apple_Gala,Fruit,104,2.41,250.64,0,lb,2025-09-14,1.95,1.95
15-09-2025,Giant_Store_001,1000,Apple_Gala,Fruit,83,2.41,200.03,0,lb,2025-09-15,1.95,1.95
16-09-2025,Giant_Store_001,1000,Apple_Gala,Fruit,106,2.41,255.46,0,lb,2025-09-16,1.95,1.95
17-09-2025,Giant_Store_001,1000,Apple_Gala,Fruit,65,2.41,156.65,0,lb,2025-09-17,2.16,2.76
18-09-2025,Giant_Store_001,1000,Apple_Gala,Fruit,114,2.41,274.74,0,lb,2025-09-18,2.16,2.76
19-09-2025,Giant_Store_001,1000,Apple_Gala,Fruit,98,2.41,236.18,0,lb,2025-09-19,2.16,2.76
20-09-2025,Giant_Store_001,1000,Apple_Gala,Fruit,140,2.41,337.4,0,lb,2025-09-20,2.16,1.91
21-09-2025,Giant_Store_001,1000,Apple_Gala,Fruit,81,2.41,195.21,0,lb,2025-09-21,2.3,1.91
22-09-2025,Giant_Store_001,1000,Apple_Gala,Fruit,45,2.41,108.45,0,lb,2025-09-22,2.3,1.91
23-09-2025,Giant_Store_001,1000,Apple_Gala,Fruit,98,2.41,236.18,0,lb,2025-09-23,2.3,1.91
24-09-2025,Giant_Store_001,1000,Apple_Gala,Fruit,65,2.41,156.65,0,lb,2025-09-24,1.98,2.52
25-09-2025,Giant_Store_001,1000,Apple_Gala,Fruit,145,2.12,307.52,1,lb,2025-09-25,1.98,2.52
26-09-2025,Giant_Store_001,1000,Apple_Gala,Fruit,79,2.41,190.39,0,lb,2025-09-26,1.98,2.52
27-09-2025,Giant_Store_001,1000,Apple_Gala,Fruit,115,2.41,277.15,0,lb,2025-09-27,1.82,2.52
28-09-2025,Giant_Store_001,1000,Apple_Gala,Fruit,83,2.41,200.03,0,lb,2025-09-28,1.82,2.75
29-09-2025,Giant_Store_001,1000,Apple_Gala,Fruit,109,2.41,262.69,0,lb,2025-09-29,1.82,2.75
30-09-2025,Giant_Store_001,1000,Apple_Gala,Fruit,93,2.41,224.13,0,lb,2025-09-30,1.82,2.75
10-01-2025,Giant_Store_001,1000,Apple_Gala,Fruit,75,2.41,180.75,0,lb,2025-10-01,2.04,2.75
10-02-2025,Giant_Store_001,1000,Apple_Gala,Fruit,100,2.41,241.0,0,lb,2025-10-02,2.04,1.63
10-03-2025,Giant_Store_001,1000,Apple_Gala,Fruit,118,2.41,284.38,0,lb,2025-10-03,2.04,1.63
10-04-2025,Giant_Store_001,1000,Apple_Gala,Fruit,114,2.41,274.74,0,lb,2025-10-04,2.04,1.63
10-05-2025,Giant_Store_001,1000,Apple_Gala,Fruit,101,2.41,243.41,0,lb,2025-10-05,2.19,1.63
10-06-2025,Giant_Store_001,1000,Apple_Gala,Fruit,132,2.41,318.12,0,lb,2025-10-06,2.19,2.43
10-07-2025,Giant_Store_001,1000,Apple_Gala,Fruit,115,2.41,277.15,0,lb,2025-10-07,2.19,2.43
10-08-2025,Giant_Store_001,1000,Apple_Gala,Fruit,117,2.41,281.97,0,lb,2025-10-08,2.19,2.43
10-09-2025,Giant_Store_001,1000,Apple_Gala,Fruit,83,2.41,200.03,0,lb,2025-10-09,2.19,2.13
10-10-2025,Giant_Store_001,1000,Apple_Gala,Fruit,90,2.41,216.9,0,lb,2025-10-10,2.19,2.13
13-10-2025,Giant_Store_001,1000,Apple_Gala,Fruit,114,2.41,274.74,0,lb,2025-10-13,2.19,2.13
11-01-2025,Giant_Store_001,1000,Apple_Gala,Fruit,101,2.41,243.41,0,lb,2025-11-01,2.07,2.13
11-02-2025,Giant_Store_001,1000,Apple_Gala,Fruit,118,2.41,284.38,0,lb,2025-11-02,2.07,1.52
11-03-2025,Giant_Store_001,1000,Apple_Gala,Fruit,99,2.41,238.59,0,lb,2025-11-03,2.07,1.52
11-04-2025,Giant_Store_001,1000,Apple_Gala,Fruit,59,2.41,142.19,0,lb,2025-11-04,2.29,1.52
11-05-2025,Giant_Store_001,1000,Apple_Gala,Fruit,143,2.41,344.63,0,lb,2025-11-05,2.29,1.63
11-06-2025,Giant_Store_001,1000,Apple_Gala,Fruit,90,2.41,216.9,0,lb,2025-11-06,2.29,1.63
11-07-2025,Giant_Store_001,1000,Apple_Gala,Fruit,66,2.41,159.06,0,lb,2025-11-07,2.29,1.63
11-08-2025,Giant_Store_001,1000,Apple_Gala,Fruit,91,2.41,219.31,0,lb,2025-11-08,1.91,1.63
11-09-2025,Giant_Store_001,1000,Apple_Gala,Fruit,110,2.41,265.1,0,lb,2025-11-09,1.91,1.53
11-10-2025,Giant_Store_001,1000,Apple_Gala,Fruit,115,2.41,277.15,0,lb,2025-11-10,1.91,1.53
12-01-2025,Giant_Store_001,1000,Apple_Gala,Fruit,86,2.41,207.26,0,lb,2025-12-01,1.91,1.53
12-02-2025,Giant_Store_001,1000,Apple_Gala,Fruit,112,2.12,237.53,1,lb,2025-12-02,2.02,2.07
12-03-2025,Giant_Store_001,1000,Apple_Gala,Fruit,65,2.41,156.65,0,lb,2025-12-03,2.02,2.07
12-04-2025,Giant_Store_001,1000,Apple_Gala,Fruit,125,2.41,301.25,0,lb,2025-12-04,2.02,2.07
12-05-2025,Giant_Store_001,1000,Apple_Gala,Fruit,94,2.41,226.54,0,lb,2025-12-05,2.02,2.07
12-06-2025,Giant_Store_001,1000,Apple_Gala,Fruit,136,2.41,327.76,0,lb,2025-12-06,2.04,2.17
12-07-2025,Giant_Store_001,1000,Apple_Gala,Fruit,155,2.41,373.55,0,lb,2025-12-07,2.04,2.17
12-08-2025,Giant_Store_001,1000,Apple_Gala,Fruit,120,2.41,289.2,0,lb,2025-12-08,2.04,2.17
12-09-2025,Giant_Store_001,1000,Apple_Gala,Fruit,102,2.41,245.82,0,lb,2025-12-09,1.86,2.17
12-10-2025,Giant_Store_001,1000,Apple_Gala,Fruit,109,2.41,262.69,0,lb,2025-12-10,1.86,2.67
01-11-2024,Giant_Store_001,1001,Banana,Fruit,97,1.74,168.78,0,lb,2024-01-11,1.77,1.43
01-12-2024,Giant_Store_001,1001,Banana,Fruit,144,1.74,250.56,0,lb,2024-01-12,1.77,1.43
02-11-2024,Giant_Store_001,1001,Banana,Fruit,129,1.74,224.46,0,lb,2024-02-11,1.77,1.43
02-12-2024,Giant_Store_001,1001,Banana,Fruit,101,1.74,175.74,0,lb,2024-02-12,1.77,1.29
03-11-2024,Giant_Store_001,1001,Banana,Fruit,145,1.74,252.3,0,lb,2024-03-11,1.51,1.29
03-12-2024,Giant_Store_001,1001,Banana,Fruit,156,1.74,271.44,0,lb,2024-03-12,1.51,1.29
04-11-2024,Giant_Store_001,1001,Banana,Fruit,84,1.74,146.16,0,lb,2024-04-11,1.51,1.29
04-12-2024,Giant_Store_001,1001,Banana,Fruit,144,1.74,250.56,0,lb,2024-04-12,1.8,1.3
05-11-2024,Giant_Store_001,1001,Banana,Fruit,108,1.74,187.92,0,lb,2024-05-11,1.8,1.3
05-12-2024,Giant_Store_001,1001,Banana,Fruit,96,1.74,167.04,0,lb,2024-05-12,1.8,1.3
06-11-2024,Giant_Store_001,1001,Banana,Fruit,128,1.74,222.72,0,lb,2024-06-11,1.8,1.4
06-12-2024,Giant_Store_001,1001,Banana,Fruit,130,1.74,226.2,0,lb,2024-06-12,1.7,1.4
07-11-2024,Giant_Store_001,1001,Banana,Fruit,132,1.74,229.68,0,lb,2024-07-11,1.7,1.4
07-12-2024,Giant_Store_001,1001,Banana,Fruit,123,1.74,214.02,0,lb,2024-07-12,1.7,1.4
08-11-2024,Giant_Store_001,1001,Banana,Fruit,91,1.74,158.34,0,lb,2024-08-11,1.7,1.3
08-12-2024,Giant_Store_001,1001,Banana,Fruit,144,1.74,250.56,0,lb,2024-08-12,1.86,1.3
09-11-2024,Giant_Store_001,1001,Banana,Fruit,185,1.74,321.9,0,lb,2024-09-11,1.86,1.3
09-12-2024,Giant_Store_001,1001,Banana,Fruit,149,1.74,259.26,0,lb,2024-09-12,1.86,2.18
10-11-2024,Giant_Store_001,1001,Banana,Fruit,166,1.74,288.84,0,lb,2024-10-11,1.86,2.18
10-12-2024,Giant_Store_001,1001,Banana,Fruit,124,1.74,215.76,0,lb,2024-10-12,1.69,2.18
14-10-2024,Giant_Store_001,1001,Banana,Fruit,113,1.74,196.62,0,lb,2024-10-14,1.69,2.18
15-10-2024,Giant_Store_001,1001,Banana,Fruit,105,1.74,182.7,0,lb,2024-10-15,1.69,1.47
16-10-2024,Giant_Store_001,1001,Banana,Fruit,131,1.74,227.94,0,lb,2024-10-16,1.76,1.47
17-10-2024,Giant_Store_001,1001,Banana,Fruit,111,1.74,193.14,0,lb,2024-10-17,1.76,1.47
18-10-2024,Giant_Store_001,1001,Banana,Fruit,82,1.74,142.68,0,lb,2024-10-18,1.76,1.47
19-10-2024,Giant_Store_001,1001,Banana,Fruit,162,1.74,281.88,0,lb,2024-10-19,1.79,1.4
20-10-2024,Giant_Store_001,1001,Banana,Fruit,143,1.74,248.82,0,lb,2024-10-20,1.79,1.4
21-10-2024,Giant_Store_001,1001,Banana,Fruit,135,1.74,234.9,0,lb,2024-10-21,1.79,1.4
22-10-2024,Giant_Store_001,1001,Banana,Fruit,119,1.74,207.06,0,lb,2024-10-22,1.86,1.4
23-10-2024,Giant_Store_001,1001,Banana,Fruit,105,1.74,182.7,0,lb,2024-10-23,1.86,1.57
24-10-2024,Giant_Store_001,1001,Banana,Fruit,89,1.74,154.86,0,lb,2024-10-24,1.86,1.57
25-10-2024,Giant_Store_001,1001,Banana,Fruit,138,1.74,240.12,0,lb,2024-10-25,1.99,1.57
26-10-2024,Giant_Store_001,1001,Banana,Fruit,157,1.74,273.18,0,lb,2024-10-26,1.99,1.57
27-10-2024,Giant_Store_001,1001,Banana,Fruit,146,1.74,254.04,0,lb,2024-10-27,1.99,1.55
28-10-2024,Giant_Store_001,1001,Banana,Fruit,128,1.74,222.72,0,lb,2024-10-28,1.99,1.55
29-10-2024,Giant_Store_001,1001,Banana,Fruit,81,1.74,140.94,0,lb,2024-10-29,1.84,1.55
30-10-2024,Giant_Store_001,1001,Banana,Fruit,133,1.74,231.42,0,lb,2024-10-30,1.84,2.21
31-10-2024,Giant_Store_001,1001,Banana,Fruit,134,1.74,233.16,0,lb,2024-10-31,1.84,2.21
11-11-2024,Giant_Store_001,1001,Banana,Fruit,134,1.74,233.16,0,lb,2024-11-11,1.87,2.21
11-12-2024,Giant_Store_001,1001,Banana,Fruit,136,1.74,236.64,0,lb,2024-11-12,1.87,2.21
13-11-2024,Giant_Store_001,1001,Banana,Fruit,186,1.53,284.8,1,lb,2024-11-13,1.87,1.23
14-11-2024,Giant_Store_001,1001,Banana,Fruit,147,1.74,255.78,0,lb,2024-11-14,1.85,1.23
15-11-2024,Giant_Store_001,1001,Banana,Fruit,110,1.74,191.4,0,lb,2024-11-15,1.85,1.23
16-11-2024,Giant_Store_001,1001,Banana,Fruit,116,1.74,201.84,0,lb,2024-11-16,1.85,1.3
17-11-2024,Giant_Store_001,1001,Banana,Fruit,116,1.74,201.84,0,lb,2024-11-17,1.85,1.3
18-11-2024,Giant_Store_001,1001,Banana,Fruit,109,1.74,189.66,0,lb,2024-11-18,1.94,1.3
19-11-2024,Giant_Store_001,1001,Banana,Fruit,156,1.74,271.44,0,lb,2024-11-19,1.94,1.3
20-11-2024,Giant_Store_001,1001,Banana,Fruit,139,1.74,241.86,0,lb,2024-11-20,1.94,1.44
21-11-2024,Giant_Store_001,1001,Banana,Fruit,101,1.74,175.74,0,lb,2024-11-21,1.94,1.44
22-11-2024,Giant_Store_001,1001,Banana,Fruit,113,1.74,196.62,0,lb,2024-11-22,1.87,1.44
23-11-2024,Giant_Store_001,1001,Banana,Fruit,179,1.53,274.08,1,lb,2024-11-23,1.87,1.53
24-11-2024,Giant_Store_001,1001,Banana,Fruit,159,1.74,276.66,0,lb,2024-11-24,1.87,1.53
25-11-2024,Giant_Store_001,1001,Banana,Fruit,108,1.74,187.92,0,lb,2024-11-25,1.87,1.53
26-11-2024,Giant_Store_001,1001,Banana,Fruit,108,1.74,187.92,0,lb,2024-11-26,1.62,1.53
27-11-2024,Giant_Store_001,1001,Banana,Fruit,122,1.74,212.28,0,lb,2024-11-27,1.62,2.19
28-11-2024,Giant_Store_001,1001,Banana,Fruit,75,1.74,130.5,0,lb,2024-11-28,1.62,2.19
29-11-2024,Giant_Store_001,1001,Banana,Fruit,108,1.74,187.92,0,lb,2024-11-29,1.87,2.19
30-11-2024,Giant_Store_001,1001,Banana,Fruit,144,1.74,250.56,0,lb,2024-11-30,1.87,1.83
12-11-2024,Giant_Store_001,1001,Banana,Fruit,110,1.74,191.4,0,lb,2024-12-11,1.87,1.83
12-12-2024,Giant_Store_001,1001,Banana,Fruit,111,1.74,193.14,0,lb,2024-12-12,1.87,1.83
13-12-2024,Giant_Store_001,1001,Banana,Fruit,111,1.74,193.14,0,lb,2024-12-13,1.57,1.83
14-12-2024,Giant_Store_001,1001,Banana,Fruit,131,1.74,227.94,0,lb,2024-12-14,1.57,2.09
15-12-2024,Giant_Store_001,1001,Banana,Fruit,141,1.74,245.34,0,lb,2024-12-15,1.57,2.09
16-12-2024,Giant_Store_001,1001,Banana,Fruit,116,1.53,177.62,1,lb,2024-12-16,1.57,2.09
17-12-2024,Giant_Store_001,1001,Banana,Fruit,163,1.74,283.62,0,lb,2024-12-17,1.71,2.09
18-12-2024,Giant_Store_001,1001,Banana,Fruit,94,1.74,163.56,0,lb,2024-12-18,1.71,2.18
19-12-2024,Giant_Store_001,1001,Banana,Fruit,123,1.74,214.02,0,lb,2024-12-19,1.71,2.18
20-12-2024,Giant_Store_001,1001,Banana,Fruit,124,1.74,215.76,0,lb,2024-12-20,1.71,2.18
21-12-2024,Giant_Store_001,1001,Banana,Fruit,214,1.53,327.68,1,lb,2024-12-21,1.61,2.18
22-12-2024,Giant_Store_001,1001,Banana,Fruit,193,1.74,335.82,0,lb,2024-12-22,1.61,1.62
23-12-2024,Giant_Store_001,1001,Banana,Fruit,117,1.74,203.58,0,lb,2024-12-23,1.61,1.62
24-12-2024,Giant_Store_001,1001,Banana,Fruit,93,1.74,161.82,0,lb,2024-12-24,1.5,1.62
25-12-2024,Giant_Store_001,1001,Banana,Fruit,165,1.74,287.1,0,lb,2024-12-25,1.5,1.62
26-12-2024,Giant_Store_001,1001,Banana,Fruit,69,1.74,120.06,0,lb,2024-12-26,1.5,1.41
27-12-2024,Giant_Store_001,1001,Banana,Fruit,85,1.74,147.9,0,lb,2024-12-27,1.5,1.41
28-12-2024,Giant_Store_001,1001,Banana,Fruit,189,1.74,328.86,0,lb,2024-12-28,1.52,1.41
29-12-2024,Giant_Store_001,1001,Banana,Fruit,150,1.74,261.0,0,lb,2024-12-29,1.52,1.43
30-12-2024,Giant_Store_001,1001,Banana,Fruit,131,1.74,227.94,0,lb,2024-12-30,1.52,1.43
31-12-2024,Giant_Store_001,1001,Banana,Fruit,107,1.74,186.18,0,lb,2024-12-31,1.52,1.43
01-01-2025,Giant_Store_001,1001,Banana,Fruit,102,1.74,177.48,0,lb,2025-01-01,1.49,2.21
01-02-2025,Giant_Store_001,1001,Banana,Fruit,134,1.74,233.16,0,lb,2025-01-02,1.49,2.21
01-03-2025,Giant_Store_001,1001,Banana,Fruit,151,1.74,262.74,0,lb,2025-01-03,1.49,2.21
01-04-2025,Giant_Store_001,1001,Banana,Fruit,99,1.74,172.26,0,lb,2025-01-04,1.49,1.41
01-05-2025,Giant_Store_001,1001,Banana,Fruit,123,1.74,214.02,0,lb,2025-01-05,1.8,1.41
01-06-2025,Giant_Store_001,1001,Banana,Fruit,190,1.74,330.6,0,lb,2025-01-06,1.8,1.41
01-07-2025,Giant_Store_001,1001,Banana,Fruit,127,1.74,220.98,0,lb,2025-01-07,1.8,1.41
01-08-2025,Giant_Store_001,1001,Banana,Fruit,100,1.74,174.0,0,lb,2025-01-08,1.8,1.4
01-09-2025,Giant_Store_001,1001,Banana,Fruit,113,1.53,173.03,1,lb,2025-01-09,1.95,1.4
01-10-2025,Giant_Store_001,1001,Banana,Fruit,103,1.74,179.22,0,lb,2025-01-10,1.95,1.4
13-01-2025,Giant_Store_001,1001,Banana,Fruit,122,1.74,212.28,0,lb,2025-01-13,1.95,1.51
14-01-2025,Giant_Store_001,1001,Banana,Fruit,80,1.74,139.2,0,lb,2025-01-14,1.59,1.51
15-01-2025,Giant_Store_001,1001,Banana,Fruit,127,1.74,220.98,0,lb,2025-01-15,1.59,1.51
16-01-2025,Giant_Store_001,1001,Banana,Fruit,115,1.74,200.1,0,lb,2025-01-16,1.59,1.56
17-01-2025,Giant_Store_001,1001,Banana,Fruit,108,1.74,187.92,0,lb,2025-01-17,1.59,1.56
18-01-2025,Giant_Store_001,1001,Banana,Fruit,122,1.74,212.28,0,lb,2025-01-18,1.84,1.56
19-01-2025,Giant_Store_001,1001,Banana,Fruit,135,1.74,234.9,0,lb,2025-01-19,1.84,1.62
20-01-2025,Giant_Store_001,1001,Banana,Fruit,136,1.53,208.24,1,lb,2025-01-20,1.84,1.62
21-01-2025,Giant_Store_001,1001,Banana,Fruit,120,1.74,208.8,0,lb,2025-01-21,1.74,1.62
22-01-2025,Giant_Store_001,1001,Banana,Fruit,121,1.74,210.54,0,lb,2025-01-22,1.74,1.62
23-01-2025,Giant_Store_001,1001,Banana,Fruit,160,1.74,278.4,0,lb,2025-01-23,1.74,1.4
24-01-2025,Giant_Store_001,1001,Banana,Fruit,120,1.74,208.8,0,lb,2025-01-24,1.99,1.4
25-01-2025,Giant_Store_001,1001,Banana,Fruit,93,1.74,161.82,0,lb,2025-01-25,1.99,1.4
26-01-2025,Giant_Store_001,1001,Banana,Fruit,217,1.74,377.58,0,lb,2025-01-26,1.99,1.4
27-01-2025,Giant_Store_001,1001,Banana,Fruit,155,1.74,269.7,0,lb,2025-01-27,1.99,2.1
28-01-2025,Giant_Store_001,1001,Banana,Fruit,97,1.74,168.78,0,lb,2025-01-28,1.63,2.1
29-01-2025,Giant_Store_001,1001,Banana,Fruit,89,1.53,136.28,1,lb,2025-01-29,1.63,2.1
30-01-2025,Giant_Store_001,1001,Banana,Fruit,93,1.74,161.82,0,lb,2025-01-30,1.63,2.1
31-01-2025,Giant_Store_001,1001,Banana,Fruit,109,1.74,189.66,0,lb,2025-01-31,1.63,2.18
02-01-2025,Giant_Store_001,1001,Banana,Fruit,87,1.74,151.38,0,lb,2025-02-01,1.58,2.18
02-02-2025,Giant_Store_001,1001,Banana,Fruit,114,1.74,198.36,0,lb,2025-02-02,1.58,2.18
02-03-2025,Giant_Store_001,1001,Banana,Fruit,150,1.74,261.0,0,lb,2025-02-03,1.58,2.18
02-04-2025,Giant_Store_001,1001,Banana,Fruit,101,1.74,175.74,0,lb,2025-02-04,1.76,2.16
02-05-2025,Giant_Store_001,1001,Banana,Fruit,142,1.74,247.08,0,lb,2025-02-05,1.76,2.16
02-06-2025,Giant_Store_001,1001,Banana,Fruit,128,1.74,222.72,0,lb,2025-02-06,1.76,2.16
02-07-2025,Giant_Store_001,1001,Banana,Fruit,136,1.74,236.64,0,lb,2025-02-07,1.76,2.16
02-08-2025,Giant_Store_001,1001,Banana,Fruit,203,1.74,353.22,0,lb,2025-02-08,1.53,1.43
02-09-2025,Giant_Store_001,1001,Banana,Fruit,124,1.74,215.76,0,lb,2025-02-09,1.53,1.43
02-10-2025,Giant_Store_001,1001,Banana,Fruit,114,1.74,198.36,0,lb,2025-02-10,1.53,1.43
13-02-2025,Giant_Store_001,1001,Banana,Fruit,96,1.74,167.04,0,lb,2025-02-13,1.5,1.43
14-02-2025,Giant_Store_001,1001,Banana,Fruit,92,1.74,160.08,0,lb,2025-02-14,1.5,1.35
15-02-2025,Giant_Store_001,1001,Banana,Fruit,153,1.74,266.22,0,lb,2025-02-15,1.5,1.35
16-02-2025,Giant_Store_001,1001,Banana,Fruit,164,1.74,285.36,0,lb,2025-02-16,1.85,1.35
17-02-2025,Giant_Store_001,1001,Banana,Fruit,147,1.53,225.09,1,lb,2025-02-17,1.85,1.28
18-02-2025,Giant_Store_001,1001,Banana,Fruit,115,1.74,200.1,0,lb,2025-02-18,1.85,1.28
19-02-2025,Giant_Store_001,1001,Banana,Fruit,145,1.53,222.02,1,lb,2025-02-19,1.85,1.28
20-02-2025,Giant_Store_001,1001,Banana,Fruit,94,1.74,163.56,0,lb,2025-02-20,1.62,1.28
21-02-2025,Giant_Store_001,1001,Banana,Fruit,128,1.74,222.72,0,lb,2025-02-21,1.62,1.43
22-02-2025,Giant_Store_001,1001,Banana,Fruit,155,1.74,269.7,0,lb,2025-02-22,1.62,1.43
23-02-2025,Giant_Store_001,1001,Banana,Fruit,91,1.74,158.34,0,lb,2025-02-23,1.62,1.43
24-02-2025,Giant_Store_001,1001,Banana,Fruit,103,1.74,179.22,0,lb,2025-02-24,1.82,1.36
25-02-2025,Giant_Store_001,1001,Banana,Fruit,131,1.53,200.59,1,lb,2025-02-25,1.82,1.36
26-02-2025,Giant_Store_001,1001,Banana,Fruit,103,1.74,179.22,0,lb,2025-02-26,1.82,1.36
27-02-2025,Giant_Store_001,1001,Banana,Fruit,133,1.74,231.42,0,lb,2025-02-27,1.82,1.36
28-02-2025,Giant_Store_001,1001,Banana,Fruit,99,1.74,172.26,0,lb,2025-02-28,1.91,1.96
03-01-2025,Giant_Store_001,1001,Banana,Fruit,219,1.53,335.33,1,lb,2025-03-01,1.91,1.96
03-02-2025,Giant_Store_001,1001,Banana,Fruit,126,1.53,192.93,1,lb,2025-03-02,1.91,1.96
03-03-2025,Giant_Store_001,1001,Banana,Fruit,98,1.74,170.52,0,lb,2025-03-03,1.91,1.96
03-04-2025,Giant_Store_001,1001,Banana,Fruit,81,1.74,140.94,0,lb,2025-03-04,1.53,2.0
03-05-2025,Giant_Store_001,1001,Banana,Fruit,99,1.74,172.26,0,lb,2025-03-05,1.53,2.0
03-06-2025,Giant_Store_001,1001,Banana,Fruit,125,1.74,217.5,0,lb,2025-03-06,1.53,2.0
03-07-2025,Giant_Store_001,1001,Banana,Fruit,139,1.74,241.86,0,lb,2025-03-07,1.7,2.0
03-08-2025,Giant_Store_001,1001,Banana,Fruit,146,1.74,254.04,0,lb,2025-03-08,1.7,2.02
03-09-2025,Giant_Store_001,1001,Banana,Fruit,80,1.74,139.2,0,lb,2025-03-09,1.7,2.02
03-10-2025,Giant_Store_001,1001,Banana,Fruit,160,1.74,278.4,0,lb,2025-03-10,1.81,2.02
13-03-2025,Giant_Store_001,1001,Banana,Fruit,113,1.74,196.62,0,lb,2025-03-13,1.81,2.02
14-03-2025,Giant_Store_001,1001,Banana,Fruit,96,1.74,167.04,0,lb,2025-03-14,1.81,2.15
15-03-2025,Giant_Store_001,1001,Banana,Fruit,157,1.74,273.18,0,lb,2025-03-15,1.81,2.15
16-03-2025,Giant_Store_001,1001,Banana,Fruit,149,1.74,259.26,0,lb,2025-03-16,1.7,2.15
17-03-2025,Giant_Store_001,1001,Banana,Fruit,115,1.74,200.1,0,lb,2025-03-17,1.7,1.48
18-03-2025,Giant_Store_001,1001,Banana,Fruit,104,1.74,180.96,0,lb,2025-03-18,1.7,1.48
19-03-2025,Giant_Store_001,1001,Banana,Fruit,141,1.74,245.34,0,lb,2025-03-19,1.7,1.48
20-03-2025,Giant_Store_001,1001,Banana,Fruit,129,1.74,224.46,0,lb,2025-03-20,1.59,1.48
21-03-2025,Giant_Store_001,1001,Banana,Fruit,128,1.74,222.72,0,lb,2025-03-21,1.59,2.03
22-03-2025,Giant_Store_001,1001,Banana,Fruit,151,1.74,262.74,0,lb,2025-03-22,1.59,2.03
23-03-2025,Giant_Store_001,1001,Banana,Fruit,181,1.74,314.94,0,lb,2025-03-23,1.59,2.03
24-03-2025,Giant_Store_001,1001,Banana,Fruit,102,1.74,177.48,0,lb,2025-03-24,1.82,1.8
25-03-2025,Giant_Store_001,1001,Banana,Fruit,101,1.74,175.74,0,lb,2025-03-25,1.82,1.8
26-03-2025,Giant_Store_001,1001,Banana,Fruit,143,1.74,248.82,0,lb,2025-03-26,1.82,1.8
27-03-2025,Giant_Store_001,1001,Banana,Fruit,82,1.53,125.56,1,lb,2025-03-27,1.63,1.8
28-03-2025,Giant_Store_001,1001,Banana,Fruit,121,1.74,210.54,0,lb,2025-03-28,1.63,1.8
29-03-2025,Giant_Store_001,1001,Banana,Fruit,132,1.74,229.68,0,lb,2025-03-29,1.63,1.8
30-03-2025,Giant_Store_001,1001,Banana,Fruit,179,1.74,311.46,0,lb,2025-03-30,1.57,1.63
31-03-2025,Giant_Store_001,1001,Banana,Fruit,140,1.74,243.6,0,lb,2025-03-31,1.57,1.63
04-01-2025,Giant_Store_001,1001,Banana,Fruit,122,1.74,212.28,0,lb,2025-04-01,1.57,1.63
04-02-2025,Giant_Store_001,1001,Banana,Fruit,111,1.74,193.14,0,lb,2025-04-02,1.88,1.71
04-03-2025,Giant_Store_001,1001,Banana,Fruit,99,1.74,172.26,0,lb,2025-04-03,1.88,1.71
04-04-2025,Giant_Store_001,1001,Banana,Fruit,150,1.74,261.0,0,lb,2025-04-04,1.88,1.71
04-05-2025,Giant_Store_001,1001,Banana,Fruit,165,1.74,287.1,0,lb,2025-04-05,1.49,1.71
04-06-2025,Giant_Store_001,1001,Banana,Fruit,110,1.74,191.4,0,lb,2025-04-06,1.49,1.31
04-07-2025,Giant_Store_001,1001,Banana,Fruit,131,1.74,227.94,0,lb,2025-04-07,1.49,1.31
04-08-2025,Giant_Store_001,1001,Banana,Fruit,117,1.74,203.58,0,lb,2025-04-08,1.77,1.31
04-09-2025,Giant_Store_001,1001,Banana,Fruit,145,1.74,252.3,0,lb,2025-04-09,1.77,2.02
04-10-2025,Giant_Store_001,1001,Banana,Fruit,177,1.53,271.02,1,lb,2025-04-10,1.77,2.02
13-04-2025,Giant_Store_001,1001,Banana,Fruit,123,1.74,214.02,0,lb,2025-04-13,1.66,2.02
14-04-2025,Giant_Store_001,1001,Banana,Fruit,88,1.74,153.12,0,lb,2025-04-14,1.66,1.55
15-04-2025,Giant_Store_001,1001,Banana,Fruit,112,1.74,194.88,0,lb,2025-04-15,1.66,1.55
16-04-2025,Giant_Store_001,1001,Banana,Fruit,95,1.74,165.3,0,lb,2025-04-16,1.66,1.55
17-04-2025,Giant_Store_001,1001,Banana,Fruit,101,1.74,175.74,0,lb,2025-04-17,1.66,1.55
18-04-2025,Giant_Store_001,1001,Banana,Fruit,132,1.74,229.68,0,lb,2025-04-18,1.66,2.25
19-04-2025,Giant_Store_001,1001,Banana,Fruit,154,1.74,267.96,0,lb,2025-04-19,1.66,2.25
20-04-2025,Giant_Store_001,1001,Banana,Fruit,114,1.74,198.36,0,lb,2025-04-20,1.66,2.25
21-04-2025,Giant_Store_001,1001,Banana,Fruit,159,1.53,243.46,1,lb,2025-04-21,1.63,1.81
22-04-2025,Giant_Store_001,1001,Banana,Fruit,113,1.74,196.62,0,lb,2025-04-22,1.63,1.81
23-04-2025,Giant_Store_001,1001,Banana,Fruit,144,1.74,250.56,0,lb,2025-04-23,1.63,1.81
24-04-2025,Giant_Store_001,1001,Banana,Fruit,138,1.74,240.12,0,lb,2025-04-24,1.53,1.81
25-04-2025,Giant_Store_001,1001,Banana,Fruit,136,1.74,236.64,0,lb,2025-04-25,1.53,2.06
26-04-2025,Giant_Store_001,1001,Banana,Fruit,152,1.74,264.48,0,lb,2025-04-26,1.53,2.06
27-04-2025,Giant_Store_001,1001,Banana,Fruit,155,1.74,269.7,0,lb,2025-04-27,1.58,2.06
28-04-2025,Giant_Store_001,1001,Banana,Fruit,150,1.74,261.0,0,lb,2025-04-28,1.58,2.06
29-04-2025,Giant_Store_001,1001,Banana,Fruit,99,1.74,172.26,0,lb,2025-04-29,1.58,1.76
30-04-2025,Giant_Store_001,1001,Banana,Fruit,110,1.74,191.4,0,lb,2025-04-30,1.54,1.76
05-01-2025,Giant_Store_001,1001,Banana,Fruit,132,1.74,229.68,0,lb,2025-05-01,1.54,1.76
05-02-2025,Giant_Store_001,1001,Banana,Fruit,98,1.74,170.52,0,lb,2025-05-02,1.54,1.97
05-03-2025,Giant_Store_001,1001,Banana,Fruit,149,1.74,259.26,0,lb,2025-05-03,1.54,1.97
05-04-2025,Giant_Store_001,1001,Banana,Fruit,187,1.74,325.38,0,lb,2025-05-04,1.61,1.97
05-05-2025,Giant_Store_001,1001,Banana,Fruit,107,1.74,186.18,0,lb,2025-05-05,1.61,2.23
05-06-2025,Giant_Store_001,1001,Banana,Fruit,110,1.74,191.4,0,lb,2025-05-06,1.61,2.23
05-07-2025,Giant_Store_001,1001,Banana,Fruit,181,1.74,314.94,0,lb,2025-05-07,1.99,2.23
05-08-2025,Giant_Store_001,1001,Banana,Fruit,139,1.74,241.86,0,lb,2025-05-08,1.99,2.03
05-09-2025,Giant_Store_001,1001,Banana,Fruit,138,1.53,211.31,1,lb,2025-05-09,1.99,2.03
05-10-2025,Giant_Store_001,1001,Banana,Fruit,128,1.74,222.72,0,lb,2025-05-10,1.76,2.03
13-05-2025,Giant_Store_001,1001,Banana,Fruit,118,1.74,205.32,0,lb,2025-05-13,1.76,2.03
14-05-2025,Giant_Store_001,1001,Banana,Fruit,131,1.74,227.94,0,lb,2025-05-14,1.76,1.83
15-05-2025,Giant_Store_001,1001,Banana,Fruit,173,1.74,301.02,0,lb,2025-05-15,1.76,1.83
16-05-2025,Giant_Store_001,1001,Banana,Fruit,117,1.74,203.58,0,lb,2025-05-16,1.97,1.83
17-05-2025,Giant_Store_001,1001,Banana,Fruit,136,1.74,236.64,0,lb,2025-05-17,1.97,1.83
18-05-2025,Giant_Store_001,1001,Banana,Fruit,129,1.74,224.46,0,lb,2025-05-18,1.97,1.56
19-05-2025,Giant_Store_001,1001,Banana,Fruit,122,1.74,212.28,0,lb,2025-05-19,1.69,1.56
20-05-2025,Giant_Store_001,1001,Banana,Fruit,133,1.74,231.42,0,lb,2025-05-20,1.69,1.56
21-05-2025,Giant_Store_001,1001,Banana,Fruit,85,1.74,147.9,0,lb,2025-05-21,1.69,1.56
22-05-2025,Giant_Store_001,1001,Banana,Fruit,80,1.74,139.2,0,lb,2025-05-22,1.55,2.25
23-05-2025,Giant_Store_001,1001,Banana,Fruit,125,1.74,217.5,0,lb,2025-05-23,1.55,2.25
24-05-2025,Giant_Store_001,1001,Banana,Fruit,120,1.74,208.8,0,lb,2025-05-24,1.55,2.25
25-05-2025,Giant_Store_001,1001,Banana,Fruit,104,1.74,180.96,0,lb,2025-05-25,1.55,1.47
26-05-2025,Giant_Store_001,1001,Banana,Fruit,139,1.74,241.86,0,lb,2025-05-26,1.64,1.47
27-05-2025,Giant_Store_001,1001,Banana,Fruit,108,1.74,187.92,0,lb,2025-05-27,1.64,1.47
28-05-2025,Giant_Store_001,1001,Banana,Fruit,96,1.74,167.04,0,lb,2025-05-28,1.64,1.47
29-05-2025,Giant_Store_001,1001,Banana,Fruit,141,1.74,245.34,0,lb,2025-05-29,1.64,1.65
30-05-2025,Giant_Store_001,1001,Banana,Fruit,147,1.74,255.78,0,lb,2025-05-30,1.68,1.65
31-05-2025,Giant_Store_001,1001,Banana,Fruit,105,1.74,182.7,0,lb,2025-05-31,1.68,1.65
06-01-2025,Giant_Store_001,1001,Banana,Fruit,97,1.74,168.78,0,lb,2025-06-01,1.68,1.65
06-02-2025,Giant_Store_001,1001,Banana,Fruit,129,1.74,224.46,0,lb,2025-06-02,1.56,1.68
06-03-2025,Giant_Store_001,1001,Banana,Fruit,98,1.74,170.52,0,lb,2025-06-03,1.56,1.68
06-04-2025,Giant_Store_001,1001,Banana,Fruit,129,1.74,224.46,0,lb,2025-06-04,1.56,1.68
06-05-2025,Giant_Store_001,1001,Banana,Fruit,177,1.53,271.02,1,lb,2025-06-05,1.56,1.68
06-06-2025,Giant_Store_001,1001,Banana,Fruit,114,1.74,198.36,0,lb,2025-06-06,1.77,1.26
06-07-2025,Giant_Store_001,1001,Banana,Fruit,183,1.74,318.42,0,lb,2025-06-07,1.77,1.26
06-08-2025,Giant_Store_001,1001,Banana,Fruit,132,1.74,229.68,0,lb,2025-06-08,1.77,1.26
06-09-2025,Giant_Store_001,1001,Banana,Fruit,148,1.74,257.52,0,lb,2025-06-09,1.76,1.26
06-10-2025,Giant_Store_001,1001,Banana,Fruit,86,1.74,149.64,0,lb,2025-06-10,1.76,1.97
13-06-2025,Giant_Store_001,1001,Banana,Fruit,131,1.74,227.94,0,lb,2025-06-13,1.76,1.97
14-06-2025,Giant_Store_001,1001,Banana,Fruit,164,1.74,285.36,0,lb,2025-06-14,1.6,1.97
15-06-2025,Giant_Store_001,1001,Banana,Fruit,190,1.74,330.6,0,lb,2025-06-15,1.6,2.21
16-06-2025,Giant_Store_001,1001,Banana,Fruit,133,1.53,203.65,1,lb,2025-06-16,1.6,2.21
17-06-2025,Giant_Store_001,1001,Banana,Fruit,142,1.74,247.08,0,lb,2025-06-17,1.6,2.21
18-06-2025,Giant_Store_001,1001,Banana,Fruit,132,1.74,229.68,0,lb,2025-06-18,1.66,1.44
19-06-2025,Giant_Store_001,1001,Banana,Fruit,107,1.74,186.18,0,lb,2025-06-19,1.66,1.44
20-06-2025,Giant_Store_001,1001,Banana,Fruit,172,1.74,299.28,0,lb,2025-06-20,1.66,1.44
21-06-2025,Giant_Store_001,1001,Banana,Fruit,207,1.53,316.96,1,lb,2025-06-21,1.66,1.44
22-06-2025,Giant_Store_001,1001,Banana,Fruit,161,1.74,280.14,0,lb,2025-06-22,1.96,1.4
23-06-2025,Giant_Store_001,1001,Banana,Fruit,136,1.74,236.64,0,lb,2025-06-23,1.96,1.4
24-06-2025,Giant_Store_001,1001,Banana,Fruit,137,1.74,238.38,0,lb,2025-06-24,1.96,1.4
25-06-2025,Giant_Store_001,1001,Banana,Fruit,79,1.74,137.46,0,lb,2025-06-25,1.86,1.4
26-06-2025,Giant_Store_001,1001,Banana,Fruit,110,1.74,191.4,0,lb,2025-06-26,1.86,1.93
27-06-2025,Giant_Store_001,1001,Banana,Fruit,139,1.74,241.86,0,lb,2025-06-27,1.86,1.93
28-06-2025,Giant_Store_001,1001,Banana,Fruit,146,1.74,254.04,0,lb,2025-06-28,1.68,1.93
29-06-2025,Giant_Store_001,1001,Banana,Fruit,142,1.74,247.08,0,lb,2025-06-29,1.68,1.93
30-06-2025,Giant_Store_001,1001,Banana,Fruit,125,1.74,217.5,0,lb,2025-06-30,1.68,1.95
07-01-2025,Giant_Store_001,1001,Banana,Fruit,110,1.74,191.4,0,lb,2025-07-01,1.68,1.95
07-02-2025,Giant_Store_001,1001,Banana,Fruit,111,1.74,193.14,0,lb,2025-07-02,1.69,1.95
07-03-2025,Giant_Store_001,1001,Banana,Fruit,107,1.74,186.18,0,lb,2025-07-03,1.69,2.16
07-04-2025,Giant_Store_001,1001,Banana,Fruit,129,1.74,224.46,0,lb,2025-07-04,1.69,2.16
07-05-2025,Giant_Store_001,1001,Banana,Fruit,121,1.74,210.54,0,lb,2025-07-05,1.69,2.16
07-06-2025,Giant_Store_001,1001,Banana,Fruit,103,1.74,179.22,0,lb,2025-07-06,1.96,1.76
07-07-2025,Giant_Store_001,1001,Banana,Fruit,169,1.74,294.06,0,lb,2025-07-07,1.96,1.76
07-08-2025,Giant_Store_001,1001,Banana,Fruit,133,1.74,231.42,0,lb,2025-07-08,1.96,1.76
07-09-2025,Giant_Store_001,1001,Banana,Fruit,168,1.74,292.32,0,lb,2025-07-09,1.96,1.37
07-10-2025,Giant_Store_001,1001,Banana,Fruit,96,1.74,167.04,0,lb,2025-07-10,1.97,1.37
13-07-2025,Giant_Store_001,1001,Banana,Fruit,179,1.74,311.46,0,lb,2025-07-13,1.97,1.37
14-07-2025,Giant_Store_001,1001,Banana,Fruit,145,1.74,252.3,0,lb,2025-07-14,1.97,1.37
15-07-2025,Giant_Store_001,1001,Banana,Fruit,118,1.74,205.32,0,lb,2025-07-15,1.95,1.78
16-07-2025,Giant_Store_001,1001,Banana,Fruit,96,1.74,167.04,0,lb,2025-07-16,1.95,1.78
17-07-2025,Giant_Store_001,1001,Banana,Fruit,154,1.74,267.96,0,lb,2025-07-17,1.95,1.78
18-07-2025,Giant_Store_001,1001,Banana,Fruit,81,1.74,140.94,0,lb,2025-07-18,1.95,1.78
19-07-2025,Giant_Store_001,1001,Banana,Fruit,190,1.74,330.6,0,lb,2025-07-19,1.73,2.11
20-07-2025,Giant_Store_001,1001,Banana,Fruit,97,1.74,168.78,0,lb,2025-07-20,1.73,2.11
21-07-2025,Giant_Store_001,1001,Banana,Fruit,227,1.53,347.58,1,lb,2025-07-21,1.73,2.11
22-07-2025,Giant_Store_001,1001,Banana,Fruit,138,1.74,240.12,0,lb,2025-07-22,1.8,1.3
23-07-2025,Giant_Store_001,1001,Banana,Fruit,103,1.74,179.22,0,lb,2025-07-23,1.8,1.3
24-07-2025,Giant_Store_001,1001,Banana,Fruit,141,1.74,245.34,0,lb,2025-07-24,1.8,1.3
25-07-2025,Giant_Store_001,1001,Banana,Fruit,128,1.74,222.72,0,lb,2025-07-25,1.76,1.98
26-07-2025,Giant_Store_001,1001,Banana,Fruit,162,1.74,281.88,0,lb,2025-07-26,1.76,1.98
27-07-2025,Giant_Store_001,1001,Banana,Fruit,125,1.74,217.5,0,lb,2025-07-27,1.76,1.98
28-07-2025,Giant_Store_001,1001,Banana,Fruit,151,1.74,262.74,0,lb,2025-07-28,1.78,1.92
29-07-2025,Giant_Store_001,1001,Banana,Fruit,77,1.74,133.98,0,lb,2025-07-29,1.78,1.92
30-07-2025,Giant_Store_001,1001,Banana,Fruit,157,1.74,273.18,0,lb,2025-07-30,1.78,1.92
31-07-2025,Giant_Store_001,1001,Banana,Fruit,129,1.74,224.46,0,lb,2025-07-31,1.49,1.36
08-01-2025,Giant_Store_001,1001,Banana,Fruit,108,1.74,187.92,0,lb,2025-08-01,1.49,1.36
08-02-2025,Giant_Store_001,1001,Banana,Fruit,166,1.74,288.84,0,lb,2025-08-02,1.49,1.36
08-03-2025,Giant_Store_001,1001,Banana,Fruit,124,1.74,215.76,0,lb,2025-08-03,1.49,2.01
08-04-2025,Giant_Store_001,1001,Banana,Fruit,136,1.74,236.64,0,lb,2025-08-04,1.81,2.01
08-05-2025,Giant_Store_001,1001,Banana,Fruit,71,1.74,123.54,0,lb,2025-08-05,1.81,2.01
08-06-2025,Giant_Store_001,1001,Banana,Fruit,222,1.74,386.28,0,lb,2025-08-06,1.81,2.01
08-07-2025,Giant_Store_001,1001,Banana,Fruit,90,1.74,156.6,0,lb,2025-08-07,1.73,1.34
08-08-2025,Giant_Store_001,1001,Banana,Fruit,116,1.74,201.84,0,lb,2025-08-08,1.73,1.34
08-09-2025,Giant_Store_001,1001,Banana,Fruit,96,1.74,167.04,0,lb,2025-08-09,1.73,1.34
08-10-2025,Giant_Store_001,1001,Banana,Fruit,114,1.74,198.36,0,lb,2025-08-10,1.73,1.92
13-08-2025,Giant_Store_001,1001,Banana,Fruit,108,1.74,187.92,0,lb,2025-08-13,1.69,1.92
14-08-2025,Giant_Store_001,1001,Banana,Fruit,124,1.74,215.76,0,lb,2025-08-14,1.69,1.92
15-08-2025,Giant_Store_001,1001,Banana,Fruit,104,1.74,180.96,0,lb,2025-08-15,1.69,2.25
16-08-2025,Giant_Store_001,1001,Banana,Fruit,218,1.53,333.8,1,lb,2025-08-16,1.97,2.25
17-08-2025,Giant_Store_001,1001,Banana,Fruit,232,1.74,403.68,0,lb,2025-08-17,1.97,2.25
18-08-2025,Giant_Store_001,1001,Banana,Fruit,137,1.74,238.38,0,lb,2025-08-18,1.97,2.25
19-08-2025,Giant_Store_001,1001,Banana,Fruit,117,1.74,203.58,0,lb,2025-08-19,1.97,1.5
20-08-2025,Giant_Store_001,1001,Banana,Fruit,102,1.74,177.48,0,lb,2025-08-20,1.98,1.5
21-08-2025,Giant_Store_001,1001,Banana,Fruit,90,1.74,156.6,0,lb,2025-08-21,1.98,1.5
22-08-2025,Giant_Store_001,1001,Banana,Fruit,136,1.74,236.64,0,lb,2025-08-22,1.98,1.41
23-08-2025,Giant_Store_001,1001,Banana,Fruit,172,1.74,299.28,0,lb,2025-08-23,1.98,1.41
24-08-2025,Giant_Store_001,1001,Banana,Fruit,185,1.74,321.9,0,lb,2025-08-24,1.51,1.41
25-08-2025,Giant_Store_001,1001,Banana,Fruit,122,1.74,212.28,0,lb,2025-08-25,1.51,1.41
26-08-2025,Giant_Store_001,1001,Banana,Fruit,101,1.74,175.74,0,lb,2025-08-26,1.51,1.62
27-08-2025,Giant_Store_001,1001,Banana,Fruit,125,1.74,217.5,0,lb,2025-08-27,1.74,1.62
28-08-2025,Giant_Store_001,1001,Banana,Fruit,152,1.74,264.48,0,lb,2025-08-28,1.74,1.62
29-08-2025,Giant_Store_001,1001,Banana,Fruit,103,1.74,179.22,0,lb,2025-08-29,1.74,2.04
30-08-2025,Giant_Store_001,1001,Banana,Fruit,138,1.74,240.12,0,lb,2025-08-30,1.74,2.04
31-08-2025,Giant_Store_001,1001,Banana,Fruit,180,1.74,313.2,0,lb,2025-08-31,1.72,2.04
09-01-2025,Giant_Store_001,1001,Banana,Fruit,124,1.74,215.76,0,lb,2025-09-01,1.72,2.04
09-02-2025,Giant_Store_001,1001,Banana,Fruit,142,1.74,247.08,0,lb,2025-09-02,1.72,1.57
09-03-2025,Giant_Store_001,1001,Banana,Fruit,211,1.53,323.08,1,lb,2025-09-03,1.85,1.57
09-04-2025,Giant_Store_001,1001,Banana,Fruit,116,1.74,201.84,0,lb,2025-09-04,1.85,1.57
09-05-2025,Giant_Store_001,1001,Banana,Fruit,83,1.74,144.42,0,lb,2025-09-05,1.85,1.57
09-06-2025,Giant_Store_001,1001,Banana,Fruit,98,1.74,170.52,0,lb,2025-09-06,1.98,2.11
09-07-2025,Giant_Store_001,1001,Banana,Fruit,149,1.74,259.26,0,lb,2025-09-07,1.98,2.11
09-08-2025,Giant_Store_001,1001,Banana,Fruit,162,1.74,281.88,0,lb,2025-09-08,1.98,2.11
09-09-2025,Giant_Store_001,1001,Banana,Fruit,128,1.74,222.72,0,lb,2025-09-09,1.98,1.4
09-10-2025,Giant_Store_001,1001,Banana,Fruit,109,1.74,189.66,0,lb,2025-09-10,1.61,1.4
13-09-2025,Giant_Store_001,1001,Banana,Fruit,133,1.74,231.42,0,lb,2025-09-13,1.61,1.4
14-09-2025,Giant_Store_001,1001,Banana,Fruit,141,1.53,215.9,1,lb,2025-09-14,1.61,2.17
15-09-2025,Giant_Store_001,1001,Banana,Fruit,127,1.74,220.98,0,lb,2025-09-15,1.96,2.17
16-09-2025,Giant_Store_001,1001,Banana,Fruit,106,1.74,184.44,0,lb,2025-09-16,1.96,2.17
17-09-2025,Giant_Store_001,1001,Banana,Fruit,80,1.74,139.2,0,lb,2025-09-17,1.96,2.07
18-09-2025,Giant_Store_001,1001,Banana,Fruit,109,1.53,166.9,1,lb,2025-09-18,2.0,2.07
19-09-2025,Giant_Store_001,1001,Banana,Fruit,84,1.74,146.16,0,lb,2025-09-19,2.0,2.07
20-09-2025,Giant_Store_001,1001,Banana,Fruit,160,1.74,278.4,0,lb,2025-09-20,2.0,1.6
21-09-2025,Giant_Store_001,1001,Banana,Fruit,93,1.74,161.82,0,lb,2025-09-21,1.88,1.6
22-09-2025,Giant_Store_001,1001,Banana,Fruit,137,1.74,238.38,0,lb,2025-09-22,1.88,1.6
23-09-2025,Giant_Store_001,1001,Banana,Fruit,124,1.74,215.76,0,lb,2025-09-23,1.88,1.22
24-09-2025,Giant_Store_001,1001,Banana,Fruit,135,1.74,234.9,0,lb,2025-09-24,1.82,1.22
25-09-2025,Giant_Store_001,1001,Banana,Fruit,141,1.53,215.9,1,lb,2025-09-25,1.82,1.22
26-09-2025,Giant_Store_001,1001,Banana,Fruit,110,1.74,191.4,0,lb,2025-09-26,1.82,1.98
27-09-2025,Giant_Store_001,1001,Banana,Fruit,148,1.74,257.52,0,lb,2025-09-27,1.94,1.98
28-09-2025,Giant_Store_001,1001,Banana,Fruit,160,1.74,278.4,0,lb,2025-09-28,1.94,1.98
29-09-2025,Giant_Store_001,1001,Banana,Fruit,126,1.74,219.24,0,lb,2025-09-29,1.94,1.98
30-09-2025,Giant_Store_001,1001,Banana,Fruit,106,1.74,184.44,0,lb,2025-09-30,1.94,1.34
10-01-2025,Giant_Store_001,1001,Banana,Fruit,143,1.74,248.82,0,lb,2025-10-01,1.69,1.34
10-02-2025,Giant_Store_001,1001,Banana,Fruit,103,1.74,179.22,0,lb,2025-10-02,1.69,1.34
10-03-2025,Giant_Store_001,1001,Banana,Fruit,124,1.74,215.76,0,lb,2025-10-03,1.69,1.34
10-04-2025,Giant_Store_001,1001,Banana,Fruit,120,1.74,208.8,0,lb,2025-10-04,1.69,1.72
10-05-2025,Giant_Store_001,1001,Banana,Fruit,126,1.74,219.24,0,lb,2025-10-05,1.94,1.72
10-06-2025,Giant_Store_001,1001,Banana,Fruit,97,1.74,168.78,0,lb,2025-10-06,1.94,1.72
10-07-2025,Giant_Store_001,1001,Banana,Fruit,119,1.74,207.06,0,lb,2025-10-07,1.94,1.39
10-08-2025,Giant_Store_001,1001,Banana,Fruit,197,1.74,342.78,0,lb,2025-10-08,1.73,1.39
10-09-2025,Giant_Store_001,1001,Banana,Fruit,77,1.74,133.98,0,lb,2025-10-09,1.73,1.39
10-10-2025,Giant_Store_001,1001,Banana,Fruit,118,1.74,205.32,0,lb,2025-10-10,1.73,1.39
13-10-2025,Giant_Store_001,1001,Banana,Fruit,111,1.74,193.14,0,lb,2025-10-13,1.76,2.24
11-01-2025,Giant_Store_001,1001,Banana,Fruit,114,1.74,198.36,0,lb,2025-11-01,1.76,2.24
11-02-2025,Giant_Store_001,1001,Banana,Fruit,121,1.74,210.54,0,lb,2025-11-02,1.76,2.24
11-03-2025,Giant_Store_001,1001,Banana,Fruit,110,1.74,191.4,0,lb,2025-11-03,1.91,2.08
11-04-2025,Giant_Store_001,1001,Banana,Fruit,114,1.74,198.36,0,lb,2025-11-04,1.91,2.08
11-05-2025,Giant_Store_001,1001,Banana,Fruit,130,1.74,226.2,0,lb,2025-11-05,1.91,2.08
11-06-2025,Giant_Store_001,1001,Banana,Fruit,92,1.74,160.08,0,lb,2025-11-06,1.57,2.08
11-07-2025,Giant_Store_001,1001,Banana,Fruit,132,1.74,229.68,0,lb,2025-11-07,1.57,2.2
11-08-2025,Giant_Store_001,1001,Banana,Fruit,115,1.74,200.1,0,lb,2025-11-08,1.57,2.2
11-09-2025,Giant_Store_001,1001,Banana,Fruit,85,1.74,147.9,0,lb,2025-11-09,1.57,2.2
11-10-2025,Giant_Store_001,1001,Banana,Fruit,173,1.74,301.02,0,lb,2025-11-10,1.75,2.18
12-01-2025,Giant_Store_001,1001,Banana,Fruit,131,1.74,227.94,0,lb,2025-12-01,1.75,2.18
12-02-2025,Giant_Store_001,1001,Banana,Fruit,87,1.74,151.38,0,lb,2025-12-02,1.75,2.18
12-03-2025,Giant_Store_001,1001,Banana,Fruit,136,1.74,236.64,0,lb,2025-12-03,1.75,2.18
12-04-2025,Giant_Store_001,1001,Banana,Fruit,156,1.53,238.87,1,lb,2025-12-04,1.97,1.68
12-05-2025,Giant_Store_001,1001,Banana,Fruit,118,1.74,205.32,0,lb,2025-12-05,1.97,1.68
12-06-2025,Giant_Store_001,1001,Banana,Fruit,161,1.74,280.14,0,lb,2025-12-06,1.97,1.68
12-07-2025,Giant_Store_001,1001,Banana,Fruit,194,1.74,337.56,0,lb,2025-12-07,1.97,1.68
12-08-2025,Giant_Store_001,1001,Banana,Fruit,139,1.74,241.86,0,lb,2025-12-08,1.54,2.16
12-09-2025,Giant_Store_001,1001,Banana,Fruit,135,1.74,234.9,0,lb,2025-12-09,1.54,2.16
12-10-2025,Giant_Store_001,1001,Banana,Fruit,75,1.74,130.5,0,lb,2025-12-10,1.54,2.16
01-11-2024,Giant_Store_001,1002,Orange_Navel,Fruit,108,1.29,139.71,1,lb,2024-01-11,1.13,1.3
01-12-2024,Giant_Store_001,1002,Orange_Navel,Fruit,154,1.47,226.38,0,lb,2024-01-12,1.13,1.3
02-11-2024,Giant_Store_001,1002,Orange_Navel,Fruit,174,1.47,255.78,0,lb,2024-02-11,1.13,1.3
02-12-2024,Giant_Store_001,1002,Orange_Navel,Fruit,117,1.47,171.99,0,lb,2024-02-12,1.4,1.3
03-11-2024,Giant_Store_001,1002,Orange_Navel,Fruit,128,1.47,188.16,0,lb,2024-03-11,1.4,1.5
03-12-2024,Giant_Store_001,1002,Orange_Navel,Fruit,162,1.29,209.56,1,lb,2024-03-12,1.4,1.5
04-11-2024,Giant_Store_001,1002,Orange_Navel,Fruit,101,1.47,148.47,0,lb,2024-04-11,1.4,1.5
04-12-2024,Giant_Store_001,1002,Orange_Navel,Fruit,110,1.47,161.7,0,lb,2024-04-12,1.47,1.27
05-11-2024,Giant_Store_001,1002,Orange_Navel,Fruit,83,1.47,122.01,0,lb,2024-05-11,1.47,1.27
05-12-2024,Giant_Store_001,1002,Orange_Navel,Fruit,113,1.47,166.11,0,lb,2024-05-12,1.47,1.27
06-11-2024,Giant_Store_001,1002,Orange_Navel,Fruit,132,1.47,194.04,0,lb,2024-06-11,1.47,1.44
06-12-2024,Giant_Store_001,1002,Orange_Navel,Fruit,140,1.47,205.8,0,lb,2024-06-12,1.41,1.44
07-11-2024,Giant_Store_001,1002,Orange_Navel,Fruit,98,1.47,144.06,0,lb,2024-07-11,1.41,1.44
07-12-2024,Giant_Store_001,1002,Orange_Navel,Fruit,151,1.47,221.97,0,lb,2024-07-12,1.41,1.64
08-11-2024,Giant_Store_001,1002,Orange_Navel,Fruit,102,1.47,149.94,0,lb,2024-08-11,1.39,1.64
08-12-2024,Giant_Store_001,1002,Orange_Navel,Fruit,135,1.47,198.45,0,lb,2024-08-12,1.39,1.64
09-11-2024,Giant_Store_001,1002,Orange_Navel,Fruit,109,1.47,160.23,0,lb,2024-09-11,1.39,1.33
09-12-2024,Giant_Store_001,1002,Orange_Navel,Fruit,101,1.47,148.47,0,lb,2024-09-12,1.35,1.33
10-11-2024,Giant_Store_001,1002,Orange_Navel,Fruit,158,1.47,232.26,0,lb,2024-10-11,1.35,1.33
10-12-2024,Giant_Store_001,1002,Orange_Navel,Fruit,151,1.29,195.33,1,lb,2024-10-12,1.35,1.33
14-10-2024,Giant_Store_001,1002,Orange_Navel,Fruit,121,1.47,177.87,0,lb,2024-10-14,1.38,1.42
15-10-2024,Giant_Store_001,1002,Orange_Navel,Fruit,155,1.47,227.85,0,lb,2024-10-15,1.38,1.42
16-10-2024,Giant_Store_001,1002,Orange_Navel,Fruit,125,1.47,183.75,0,lb,2024-10-16,1.38,1.42
17-10-2024,Giant_Store_001,1002,Orange_Navel,Fruit,103,1.47,151.41,0,lb,2024-10-17,1.3,1.42
18-10-2024,Giant_Store_001,1002,Orange_Navel,Fruit,141,1.29,182.4,1,lb,2024-10-18,1.3,1.23
19-10-2024,Giant_Store_001,1002,Orange_Navel,Fruit,128,1.47,188.16,0,lb,2024-10-19,1.3,1.23
20-10-2024,Giant_Store_001,1002,Orange_Navel,Fruit,145,1.47,213.15,0,lb,2024-10-20,1.23,1.23
21-10-2024,Giant_Store_001,1002,Orange_Navel,Fruit,128,1.47,188.16,0,lb,2024-10-21,1.23,1.57
22-10-2024,Giant_Store_001,1002,Orange_Navel,Fruit,92,1.47,135.24,0,lb,2024-10-22,1.23,1.57
23-10-2024,Giant_Store_001,1002,Orange_Navel,Fruit,120,1.47,176.4,0,lb,2024-10-23,1.34,1.57
24-10-2024,Giant_Store_001,1002,Orange_Navel,Fruit,119,1.47,174.93,0,lb,2024-10-24,1.34,1.57
25-10-2024,Giant_Store_001,1002,Orange_Navel,Fruit,111,1.47,163.17,0,lb,2024-10-25,1.34,1.09
26-10-2024,Giant_Store_001,1002,Orange_Navel,Fruit,140,1.47,205.8,0,lb,2024-10-26,1.27,1.09
27-10-2024,Giant_Store_001,1002,Orange_Navel,Fruit,115,1.47,169.05,0,lb,2024-10-27,1.27,1.09
28-10-2024,Giant_Store_001,1002,Orange_Navel,Fruit,118,1.47,173.46,0,lb,2024-10-28,1.27,1.24
29-10-2024,Giant_Store_001,1002,Orange_Navel,Fruit,94,1.47,138.18,0,lb,2024-10-29,1.27,1.24
30-10-2024,Giant_Store_001,1002,Orange_Navel,Fruit,128,1.47,188.16,0,lb,2024-10-30,1.1,1.24
31-10-2024,Giant_Store_001,1002,Orange_Navel,Fruit,141,1.29,182.4,1,lb,2024-10-31,1.1,1.24
11-11-2024,Giant_Store_001,1002,Orange_Navel,Fruit,124,1.47,182.28,0,lb,2024-11-11,1.1,0.92
11-12-2024,Giant_Store_001,1002,Orange_Navel,Fruit,136,1.47,199.92,0,lb,2024-11-12,1.1,0.92
13-11-2024,Giant_Store_001,1002,Orange_Navel,Fruit,105,1.47,154.35,0,lb,2024-11-13,1.17,0.92
14-11-2024,Giant_Store_001,1002,Orange_Navel,Fruit,141,1.47,207.27,0,lb,2024-11-14,1.17,1.3
15-11-2024,Giant_Store_001,1002,Orange_Navel,Fruit,74,1.47,108.78,0,lb,2024-11-15,1.17,1.3
16-11-2024,Giant_Store_001,1002,Orange_Navel,Fruit,211,1.47,310.17,0,lb,2024-11-16,1.17,1.3
17-11-2024,Giant_Store_001,1002,Orange_Navel,Fruit,136,1.47,199.92,0,lb,2024-11-17,1.26,1.63
18-11-2024,Giant_Store_001,1002,Orange_Navel,Fruit,92,1.47,135.24,0,lb,2024-11-18,1.26,1.63
19-11-2024,Giant_Store_001,1002,Orange_Navel,Fruit,93,1.47,136.71,0,lb,2024-11-19,1.26,1.63
20-11-2024,Giant_Store_001,1002,Orange_Navel,Fruit,125,1.47,183.75,0,lb,2024-11-20,1.33,1.63
21-11-2024,Giant_Store_001,1002,Orange_Navel,Fruit,122,1.47,179.34,0,lb,2024-11-21,1.33,1.08
22-11-2024,Giant_Store_001,1002,Orange_Navel,Fruit,136,1.47,199.92,0,lb,2024-11-22,1.33,1.08
23-11-2024,Giant_Store_001,1002,Orange_Navel,Fruit,188,1.29,243.2,1,lb,2024-11-23,1.43,1.08
24-11-2024,Giant_Store_001,1002,Orange_Navel,Fruit,131,1.47,192.57,0,lb,2024-11-24,1.43,1.08
25-11-2024,Giant_Store_001,1002,Orange_Navel,Fruit,78,1.47,114.66,0,lb,2024-11-25,1.43,1.17
26-11-2024,Giant_Store_001,1002,Orange_Navel,Fruit,113,1.47,166.11,0,lb,2024-11-26,1.43,1.17
27-11-2024,Giant_Store_001,1002,Orange_Navel,Fruit,106,1.47,155.82,0,lb,2024-11-27,1.25,1.17
28-11-2024,Giant_Store_001,1002,Orange_Navel,Fruit,125,1.47,183.75,0,lb,2024-11-28,1.25,1.17
29-11-2024,Giant_Store_001,1002,Orange_Navel,Fruit,134,1.47,196.98,0,lb,2024-11-29,1.25,1.06
30-11-2024,Giant_Store_001,1002,Orange_Navel,Fruit,150,1.47,220.5,0,lb,2024-11-30,1.14,1.06
12-11-2024,Giant_Store_001,1002,Orange_Navel,Fruit,92,1.47,135.24,0,lb,2024-12-11,1.14,1.06
12-12-2024,Giant_Store_001,1002,Orange_Navel,Fruit,125,1.47,183.75,0,lb,2024-12-12,1.14,1.06
13-12-2024,Giant_Store_001,1002,Orange_Navel,Fruit,86,1.29,111.25,1,lb,2024-12-13,1.14,1.65
14-12-2024,Giant_Store_001,1002,Orange_Navel,Fruit,147,1.47,216.09,0,lb,2024-12-14,1.43,1.65
15-12-2024,Giant_Store_001,1002,Orange_Navel,Fruit,126,1.47,185.22,0,lb,2024-12-15,1.43,1.65
16-12-2024,Giant_Store_001,1002,Orange_Navel,Fruit,138,1.47,202.86,0,lb,2024-12-16,1.43,1.65
17-12-2024,Giant_Store_001,1002,Orange_Navel,Fruit,97,1.47,142.59,0,lb,2024-12-17,1.43,0.94
18-12-2024,Giant_Store_001,1002,Orange_Navel,Fruit,111,1.47,163.17,0,lb,2024-12-18,1.12,0.94
19-12-2024,Giant_Store_001,1002,Orange_Navel,Fruit,99,1.47,145.53,0,lb,2024-12-19,1.12,0.94
20-12-2024,Giant_Store_001,1002,Orange_Navel,Fruit,128,1.47,188.16,0,lb,2024-12-20,1.12,0.94
21-12-2024,Giant_Store_001,1002,Orange_Navel,Fruit,137,1.47,201.39,0,lb,2024-12-21,1.45,1.36
22-12-2024,Giant_Store_001,1002,Orange_Navel,Fruit,139,1.47,204.33,0,lb,2024-12-22,1.45,1.36
23-12-2024,Giant_Store_001,1002,Orange_Navel,Fruit,107,1.47,157.29,0,lb,2024-12-23,1.45,1.36
24-12-2024,Giant_Store_001,1002,Orange_Navel,Fruit,128,1.47,188.16,0,lb,2024-12-24,1.35,1.01
25-12-2024,Giant_Store_001,1002,Orange_Navel,Fruit,113,1.47,166.11,0,lb,2024-12-25,1.35,1.01
26-12-2024,Giant_Store_001,1002,Orange_Navel,Fruit,93,1.47,136.71,0,lb,2024-12-26,1.35,1.01
27-12-2024,Giant_Store_001,1002,Orange_Navel,Fruit,91,1.47,133.77,0,lb,2024-12-27,1.35,1.01
28-12-2024,Giant_Store_001,1002,Orange_Navel,Fruit,204,1.29,263.89,1,lb,2024-12-28,1.22,0.94
29-12-2024,Giant_Store_001,1002,Orange_Navel,Fruit,121,1.47,177.87,0,lb,2024-12-29,1.22,0.94
30-12-2024,Giant_Store_001,1002,Orange_Navel,Fruit,118,1.47,173.46,0,lb,2024-12-30,1.22,0.94
31-12-2024,Giant_Store_001,1002,Orange_Navel,Fruit,91,1.47,133.77,0,lb,2024-12-31,1.46,1.2
01-01-2025,Giant_Store_001,1002,Orange_Navel,Fruit,106,1.47,155.82,0,lb,2025-01-01,1.46,1.2
01-02-2025,Giant_Store_001,1002,Orange_Navel,Fruit,148,1.47,217.56,0,lb,2025-01-02,1.46,1.2
01-03-2025,Giant_Store_001,1002,Orange_Navel,Fruit,131,1.47,192.57,0,lb,2025-01-03,1.24,1.65
01-04-2025,Giant_Store_001,1002,Orange_Navel,Fruit,95,1.47,139.65,0,lb,2025-01-04,1.24,1.65
01-05-2025,Giant_Store_001,1002,Orange_Navel,Fruit,133,1.47,195.51,0,lb,2025-01-05,1.24,1.65
01-06-2025,Giant_Store_001,1002,Orange_Navel,Fruit,189,1.47,277.83,0,lb,2025-01-06,1.17,1.6
01-07-2025,Giant_Store_001,1002,Orange_Navel,Fruit,160,1.29,206.98,1,lb,2025-01-07,1.17,1.6
01-08-2025,Giant_Store_001,1002,Orange_Navel,Fruit,150,1.47,220.5,0,lb,2025-01-08,1.17,1.6
01-09-2025,Giant_Store_001,1002,Orange_Navel,Fruit,88,1.47,129.36,0,lb,2025-01-09,1.17,1.18
01-10-2025,Giant_Store_001,1002,Orange_Navel,Fruit,95,1.47,139.65,0,lb,2025-01-10,1.39,1.18
13-01-2025,Giant_Store_001,1002,Orange_Navel,Fruit,120,1.47,176.4,0,lb,2025-01-13,1.39,1.18
14-01-2025,Giant_Store_001,1002,Orange_Navel,Fruit,113,1.47,166.11,0,lb,2025-01-14,1.39,1.25
15-01-2025,Giant_Store_001,1002,Orange_Navel,Fruit,125,1.47,183.75,0,lb,2025-01-15,1.39,1.25
16-01-2025,Giant_Store_001,1002,Orange_Navel,Fruit,144,1.47,211.68,0,lb,2025-01-16,1.26,1.25
17-01-2025,Giant_Store_001,1002,Orange_Navel,Fruit,103,1.47,151.41,0,lb,2025-01-17,1.26,1.25
18-01-2025,Giant_Store_001,1002,Orange_Navel,Fruit,146,1.47,214.62,0,lb,2025-01-18,1.26,0.98
19-01-2025,Giant_Store_001,1002,Orange_Navel,Fruit,120,1.47,176.4,0,lb,2025-01-19,1.26,0.98
20-01-2025,Giant_Store_001,1002,Orange_Navel,Fruit,118,1.47,173.46,0,lb,2025-01-20,1.11,0.98
21-01-2025,Giant_Store_001,1002,Orange_Navel,Fruit,89,1.47,130.83,0,lb,2025-01-21,1.11,0.94
22-01-2025,Giant_Store_001,1002,Orange_Navel,Fruit,106,1.47,155.82,0,lb,2025-01-22,1.11,0.94
23-01-2025,Giant_Store_001,1002,Orange_Navel,Fruit,126,1.47,185.22,0,lb,2025-01-23,1.44,0.94
24-01-2025,Giant_Store_001,1002,Orange_Navel,Fruit,87,1.47,127.89,0,lb,2025-01-24,1.44,0.94
25-01-2025,Giant_Store_001,1002,Orange_Navel,Fruit,170,1.47,249.9,0,lb,2025-01-25,1.44,1.38
26-01-2025,Giant_Store_001,1002,Orange_Navel,Fruit,182,1.47,267.54,0,lb,2025-01-26,1.26,1.38
27-01-2025,Giant_Store_001,1002,Orange_Navel,Fruit,133,1.47,195.51,0,lb,2025-01-27,1.26,1.38
28-01-2025,Giant_Store_001,1002,Orange_Navel,Fruit,138,1.47,202.86,0,lb,2025-01-28,1.26,1.01
29-01-2025,Giant_Store_001,1002,Orange_Navel,Fruit,115,1.47,169.05,0,lb,2025-01-29,1.26,1.01
30-01-2025,Giant_Store_001,1002,Orange_Navel,Fruit,129,1.47,189.63,0,lb,2025-01-30,1.14,1.01
31-01-2025,Giant_Store_001,1002,Orange_Navel,Fruit,137,1.47,201.39,0,lb,2025-01-31,1.14,1.27
02-01-2025,Giant_Store_001,1002,Orange_Navel,Fruit,113,1.47,166.11,0,lb,2025-02-01,1.14,1.27
02-02-2025,Giant_Store_001,1002,Orange_Navel,Fruit,56,1.47,82.32,0,lb,2025-02-02,1.2,1.27
02-03-2025,Giant_Store_001,1002,Orange_Navel,Fruit,156,1.47,229.32,0,lb,2025-02-03,1.2,1.24
02-04-2025,Giant_Store_001,1002,Orange_Navel,Fruit,111,1.47,163.17,0,lb,2025-02-04,1.2,1.24
02-05-2025,Giant_Store_001,1002,Orange_Navel,Fruit,96,1.47,141.12,0,lb,2025-02-05,1.23,1.24
02-06-2025,Giant_Store_001,1002,Orange_Navel,Fruit,188,1.29,243.2,1,lb,2025-02-06,1.23,1.33
02-07-2025,Giant_Store_001,1002,Orange_Navel,Fruit,136,1.47,199.92,0,lb,2025-02-07,1.23,1.33
02-08-2025,Giant_Store_001,1002,Orange_Navel,Fruit,184,1.47,270.48,0,lb,2025-02-08,1.34,1.33
02-09-2025,Giant_Store_001,1002,Orange_Navel,Fruit,114,1.47,167.58,0,lb,2025-02-09,1.34,1.33
02-10-2025,Giant_Store_001,1002,Orange_Navel,Fruit,135,1.47,198.45,0,lb,2025-02-10,1.34,1.31
13-02-2025,Giant_Store_001,1002,Orange_Navel,Fruit,93,1.47,136.71,0,lb,2025-02-13,1.34,1.31
14-02-2025,Giant_Store_001,1002,Orange_Navel,Fruit,121,1.47,177.87,0,lb,2025-02-14,1.41,1.31
15-02-2025,Giant_Store_001,1002,Orange_Navel,Fruit,144,1.47,211.68,0,lb,2025-02-15,1.41,0.93
16-02-2025,Giant_Store_001,1002,Orange_Navel,Fruit,176,1.47,258.72,0,lb,2025-02-16,1.41,0.93
17-02-2025,Giant_Store_001,1002,Orange_Navel,Fruit,95,1.47,139.65,0,lb,2025-02-17,1.26,0.93
18-02-2025,Giant_Store_001,1002,Orange_Navel,Fruit,130,1.47,191.1,0,lb,2025-02-18,1.26,0.93
19-02-2025,Giant_Store_001,1002,Orange_Navel,Fruit,171,1.29,221.21,1,lb,2025-02-19,1.26,1.56
20-02-2025,Giant_Store_001,1002,Orange_Navel,Fruit,128,1.47,188.16,0,lb,2025-02-20,1.26,1.56
21-02-2025,Giant_Store_001,1002,Orange_Navel,Fruit,123,1.47,180.81,0,lb,2025-02-21,1.32,1.56
22-02-2025,Giant_Store_001,1002,Orange_Navel,Fruit,114,1.47,167.58,0,lb,2025-02-22,1.32,1.26
23-02-2025,Giant_Store_001,1002,Orange_Navel,Fruit,164,1.47,241.08,0,lb,2025-02-23,1.32,1.26
24-02-2025,Giant_Store_001,1002,Orange_Navel,Fruit,131,1.47,192.57,0,lb,2025-02-24,1.44,1.26
25-02-2025,Giant_Store_001,1002,Orange_Navel,Fruit,121,1.47,177.87,0,lb,2025-02-25,1.44,1.26
26-02-2025,Giant_Store_001,1002,Orange_Navel,Fruit,114,1.47,167.58,0,lb,2025-02-26,1.44,1.13
27-02-2025,Giant_Store_001,1002,Orange_Navel,Fruit,148,1.47,217.56,0,lb,2025-02-27,1.44,1.13
28-02-2025,Giant_Store_001,1002,Orange_Navel,Fruit,148,1.47,217.56,0,lb,2025-02-28,1.21,1.13
03-01-2025,Giant_Store_001,1002,Orange_Navel,Fruit,210,1.29,271.66,1,lb,2025-03-01,1.21,1.13
03-02-2025,Giant_Store_001,1002,Orange_Navel,Fruit,138,1.47,202.86,0,lb,2025-03-02,1.21,1.64
03-03-2025,Giant_Store_001,1002,Orange_Navel,Fruit,58,1.47,85.26,0,lb,2025-03-03,1.21,1.64
03-04-2025,Giant_Store_001,1002,Orange_Navel,Fruit,136,1.47,199.92,0,lb,2025-03-04,1.11,1.64
03-05-2025,Giant_Store_001,1002,Orange_Navel,Fruit,171,1.47,251.37,0,lb,2025-03-05,1.11,1.64
03-06-2025,Giant_Store_001,1002,Orange_Navel,Fruit,94,1.47,138.18,0,lb,2025-03-06,1.11,1.13
03-07-2025,Giant_Store_001,1002,Orange_Navel,Fruit,121,1.47,177.87,0,lb,2025-03-07,1.3,1.13
03-08-2025,Giant_Store_001,1002,Orange_Navel,Fruit,237,1.29,306.58,1,lb,2025-03-08,1.3,1.13
03-09-2025,Giant_Store_001,1002,Orange_Navel,Fruit,160,1.29,206.98,1,lb,2025-03-09,1.3,1.05
03-10-2025,Giant_Store_001,1002,Orange_Navel,Fruit,149,1.47,219.03,0,lb,2025-03-10,1.36,1.05
13-03-2025,Giant_Store_001,1002,Orange_Navel,Fruit,117,1.47,171.99,0,lb,2025-03-13,1.36,1.05
14-03-2025,Giant_Store_001,1002,Orange_Navel,Fruit,149,1.29,192.75,1,lb,2025-03-14,1.36,1.48
15-03-2025,Giant_Store_001,1002,Orange_Navel,Fruit,92,1.47,135.24,0,lb,2025-03-15,1.36,1.48
16-03-2025,Giant_Store_001,1002,Orange_Navel,Fruit,162,1.47,238.14,0,lb,2025-03-16,1.16,1.48
17-03-2025,Giant_Store_001,1002,Orange_Navel,Fruit,110,1.47,161.7,0,lb,2025-03-17,1.16,1.48
18-03-2025,Giant_Store_001,1002,Orange_Navel,Fruit,109,1.47,160.23,0,lb,2025-03-18,1.16,1.55
19-03-2025,Giant_Store_001,1002,Orange_Navel,Fruit,137,1.47,201.39,0,lb,2025-03-19,1.15,1.55
20-03-2025,Giant_Store_001,1002,Orange_Navel,Fruit,106,1.47,155.82,0,lb,2025-03-20,1.15,1.55
21-03-2025,Giant_Store_001,1002,Orange_Navel,Fruit,122,1.47,179.34,0,lb,2025-03-21,1.15,1.55
22-03-2025,Giant_Store_001,1002,Orange_Navel,Fruit,142,1.47,208.74,0,lb,2025-03-22,1.15,1.33
23-03-2025,Giant_Store_001,1002,Orange_Navel,Fruit,128,1.47,188.16,0,lb,2025-03-23,1.31,1.33
24-03-2025,Giant_Store_001,1002,Orange_Navel,Fruit,92,1.47,135.24,0,lb,2025-03-24,1.31,1.33
25-03-2025,Giant_Store_001,1002,Orange_Navel,Fruit,97,1.47,142.59,0,lb,2025-03-25,1.31,1.33
26-03-2025,Giant_Store_001,1002,Orange_Navel,Fruit,110,1.47,161.7,0,lb,2025-03-26,1.33,1.34
27-03-2025,Giant_Store_001,1002,Orange_Navel,Fruit,134,1.47,196.98,0,lb,2025-03-27,1.33,1.34
28-03-2025,Giant_Store_001,1002,Orange_Navel,Fruit,67,1.47,98.49,0,lb,2025-03-28,1.33,1.34
29-03-2025,Giant_Store_001,1002,Orange_Navel,Fruit,108,1.47,158.76,0,lb,2025-03-29,1.33,0.91
30-03-2025,Giant_Store_001,1002,Orange_Navel,Fruit,156,1.47,229.32,0,lb,2025-03-30,1.33,0.91
31-03-2025,Giant_Store_001,1002,Orange_Navel,Fruit,122,1.47,179.34,0,lb,2025-03-31,1.33,0.91
04-01-2025,Giant_Store_001,1002,Orange_Navel,Fruit,111,1.47,163.17,0,lb,2025-04-01,1.35,0.91
04-02-2025,Giant_Store_001,1002,Orange_Navel,Fruit,126,1.47,185.22,0,lb,2025-04-02,1.35,0.91
04-03-2025,Giant_Store_001,1002,Orange_Navel,Fruit,97,1.47,142.59,0,lb,2025-04-03,1.35,0.91
04-04-2025,Giant_Store_001,1002,Orange_Navel,Fruit,107,1.47,157.29,0,lb,2025-04-04,1.35,0.91
04-05-2025,Giant_Store_001,1002,Orange_Navel,Fruit,151,1.47,221.97,0,lb,2025-04-05,1.38,1.45
04-06-2025,Giant_Store_001,1002,Orange_Navel,Fruit,97,1.47,142.59,0,lb,2025-04-06,1.38,1.45
04-07-2025,Giant_Store_001,1002,Orange_Navel,Fruit,110,1.47,161.7,0,lb,2025-04-07,1.38,1.45
04-08-2025,Giant_Store_001,1002,Orange_Navel,Fruit,122,1.47,179.34,0,lb,2025-04-08,1.22,1.45
04-09-2025,Giant_Store_001,1002,Orange_Navel,Fruit,70,1.47,102.9,0,lb,2025-04-09,1.22,1.09
04-10-2025,Giant_Store_001,1002,Orange_Navel,Fruit,135,1.47,198.45,0,lb,2025-04-10,1.22,1.09
13-04-2025,Giant_Store_001,1002,Orange_Navel,Fruit,158,1.47,232.26,0,lb,2025-04-13,1.22,1.09
14-04-2025,Giant_Store_001,1002,Orange_Navel,Fruit,95,1.47,139.65,0,lb,2025-04-14,1.18,1.21
15-04-2025,Giant_Store_001,1002,Orange_Navel,Fruit,116,1.47,170.52,0,lb,2025-04-15,1.18,1.21
16-04-2025,Giant_Store_001,1002,Orange_Navel,Fruit,139,1.47,204.33,0,lb,2025-04-16,1.18,1.21
17-04-2025,Giant_Store_001,1002,Orange_Navel,Fruit,104,1.47,152.88,0,lb,2025-04-17,1.18,1.21
18-04-2025,Giant_Store_001,1002,Orange_Navel,Fruit,97,1.47,142.59,0,lb,2025-04-18,1.37,1.03
19-04-2025,Giant_Store_001,1002,Orange_Navel,Fruit,137,1.47,201.39,0,lb,2025-04-19,1.37,1.03
20-04-2025,Giant_Store_001,1002,Orange_Navel,Fruit,175,1.47,257.25,0,lb,2025-04-20,1.37,1.03
21-04-2025,Giant_Store_001,1002,Orange_Navel,Fruit,99,1.47,145.53,0,lb,2025-04-21,1.42,1.64
22-04-2025,Giant_Store_001,1002,Orange_Navel,Fruit,90,1.47,132.3,0,lb,2025-04-22,1.42,1.64
23-04-2025,Giant_Store_001,1002,Orange_Navel,Fruit,124,1.47,182.28,0,lb,2025-04-23,1.42,1.64
24-04-2025,Giant_Store_001,1002,Orange_Navel,Fruit,155,1.47,227.85,0,lb,2025-04-24,1.23,1.34
25-04-2025,Giant_Store_001,1002,Orange_Navel,Fruit,76,1.47,111.72,0,lb,2025-04-25,1.23,1.34
26-04-2025,Giant_Store_001,1002,Orange_Navel,Fruit,162,1.47,238.14,0,lb,2025-04-26,1.23,1.34
27-04-2025,Giant_Store_001,1002,Orange_Navel,Fruit,135,1.47,198.45,0,lb,2025-04-27,1.27,1.34
28-04-2025,Giant_Store_001,1002,Orange_Navel,Fruit,105,1.47,154.35,0,lb,2025-04-28,1.27,1.28
29-04-2025,Giant_Store_001,1002,Orange_Navel,Fruit,115,1.47,169.05,0,lb,2025-04-29,1.27,1.28
30-04-2025,Giant_Store_001,1002,Orange_Navel,Fruit,102,1.47,149.94,0,lb,2025-04-30,1.27,1.28
05-01-2025,Giant_Store_001,1002,Orange_Navel,Fruit,171,1.47,251.37,0,lb,2025-05-01,1.14,1.28
05-02-2025,Giant_Store_001,1002,Orange_Navel,Fruit,105,1.47,154.35,0,lb,2025-05-02,1.14,1.49
05-03-2025,Giant_Store_001,1002,Orange_Navel,Fruit,104,1.47,152.88,0,lb,2025-05-03,1.14,1.49
05-04-2025,Giant_Store_001,1002,Orange_Navel,Fruit,148,1.47,217.56,0,lb,2025-05-04,1.15,1.49
05-05-2025,Giant_Store_001,1002,Orange_Navel,Fruit,101,1.47,148.47,0,lb,2025-05-05,1.15,1.49
05-06-2025,Giant_Store_001,1002,Orange_Navel,Fruit,125,1.47,183.75,0,lb,2025-05-06,1.15,1.39
05-07-2025,Giant_Store_001,1002,Orange_Navel,Fruit,161,1.47,236.67,0,lb,2025-05-07,1.2,1.39
05-08-2025,Giant_Store_001,1002,Orange_Navel,Fruit,144,1.47,211.68,0,lb,2025-05-08,1.2,1.39
05-09-2025,Giant_Store_001,1002,Orange_Navel,Fruit,189,1.29,244.49,1,lb,2025-05-09,1.2,1.39
05-10-2025,Giant_Store_001,1002,Orange_Navel,Fruit,155,1.47,227.85,0,lb,2025-05-10,1.2,1.13
13-05-2025,Giant_Store_001,1002,Orange_Navel,Fruit,129,1.47,189.63,0,lb,2025-05-13,1.31,1.13
14-05-2025,Giant_Store_001,1002,Orange_Navel,Fruit,116,1.47,170.52,0,lb,2025-05-14,1.31,1.13
15-05-2025,Giant_Store_001,1002,Orange_Navel,Fruit,116,1.47,170.52,0,lb,2025-05-15,1.31,1.13
16-05-2025,Giant_Store_001,1002,Orange_Navel,Fruit,101,1.47,148.47,0,lb,2025-05-16,1.45,1.16
17-05-2025,Giant_Store_001,1002,Orange_Navel,Fruit,184,1.47,270.48,0,lb,2025-05-17,1.45,1.16
18-05-2025,Giant_Store_001,1002,Orange_Navel,Fruit,153,1.47,224.91,0,lb,2025-05-18,1.45,1.16
19-05-2025,Giant_Store_001,1002,Orange_Navel,Fruit,89,1.47,130.83,0,lb,2025-05-19,1.45,1.16
20-05-2025,Giant_Store_001,1002,Orange_Navel,Fruit,130,1.47,191.1,0,lb,2025-05-20,1.26,1.46
21-05-2025,Giant_Store_001,1002,Orange_Navel,Fruit,126,1.47,185.22,0,lb,2025-05-21,1.26,1.46
22-05-2025,Giant_Store_001,1002,Orange_Navel,Fruit,107,1.47,157.29,0,lb,2025-05-22,1.26,1.46
23-05-2025,Giant_Store_001,1002,Orange_Navel,Fruit,135,1.29,174.64,1,lb,2025-05-23,1.15,1.46
24-05-2025,Giant_Store_001,1002,Orange_Navel,Fruit,154,1.47,226.38,0,lb,2025-05-24,1.15,1.31
25-05-2025,Giant_Store_001,1002,Orange_Navel,Fruit,116,1.47,170.52,0,lb,2025-05-25,1.15,1.31
26-05-2025,Giant_Store_001,1002,Orange_Navel,Fruit,147,1.29,190.16,1,lb,2025-05-26,1.15,1.31
27-05-2025,Giant_Store_001,1002,Orange_Navel,Fruit,101,1.47,148.47,0,lb,2025-05-27,1.18,0.96
28-05-2025,Giant_Store_001,1002,Orange_Navel,Fruit,101,1.47,148.47,0,lb,2025-05-28,1.18,0.96
29-05-2025,Giant_Store_001,1002,Orange_Navel,Fruit,110,1.47,161.7,0,lb,2025-05-29,1.18,0.96
30-05-2025,Giant_Store_001,1002,Orange_Navel,Fruit,121,1.47,177.87,0,lb,2025-05-30,1.34,0.96
31-05-2025,Giant_Store_001,1002,Orange_Navel,Fruit,148,1.47,217.56,0,lb,2025-05-31,1.34,0.95
06-01-2025,Giant_Store_001,1002,Orange_Navel,Fruit,157,1.47,230.79,0,lb,2025-06-01,1.34,0.95
06-02-2025,Giant_Store_001,1002,Orange_Navel,Fruit,105,1.47,154.35,0,lb,2025-06-02,1.34,0.95
06-03-2025,Giant_Store_001,1002,Orange_Navel,Fruit,116,1.47,170.52,0,lb,2025-06-03,1.31,0.95
06-04-2025,Giant_Store_001,1002,Orange_Navel,Fruit,142,1.47,208.74,0,lb,2025-06-04,1.31,1.47
06-05-2025,Giant_Store_001,1002,Orange_Navel,Fruit,122,1.47,179.34,0,lb,2025-06-05,1.31,1.47
06-06-2025,Giant_Store_001,1002,Orange_Navel,Fruit,107,1.47,157.29,0,lb,2025-06-06,1.46,1.47
06-07-2025,Giant_Store_001,1002,Orange_Navel,Fruit,182,1.47,267.54,0,lb,2025-06-07,1.46,1.47
06-08-2025,Giant_Store_001,1002,Orange_Navel,Fruit,115,1.47,169.05,0,lb,2025-06-08,1.46,1.18
06-09-2025,Giant_Store_001,1002,Orange_Navel,Fruit,129,1.47,189.63,0,lb,2025-06-09,1.46,1.18
06-10-2025,Giant_Store_001,1002,Orange_Navel,Fruit,119,1.47,174.93,0,lb,2025-06-10,1.17,1.18
13-06-2025,Giant_Store_001,1002,Orange_Navel,Fruit,179,1.47,263.13,0,lb,2025-06-13,1.17,1.18
14-06-2025,Giant_Store_001,1002,Orange_Navel,Fruit,191,1.47,280.77,0,lb,2025-06-14,1.17,1.56
15-06-2025,Giant_Store_001,1002,Orange_Navel,Fruit,120,1.47,176.4,0,lb,2025-06-15,1.16,1.56
16-06-2025,Giant_Store_001,1002,Orange_Navel,Fruit,124,1.47,182.28,0,lb,2025-06-16,1.16,1.56
17-06-2025,Giant_Store_001,1002,Orange_Navel,Fruit,122,1.29,157.82,1,lb,2025-06-17,1.16,1.56
18-06-2025,Giant_Store_001,1002,Orange_Navel,Fruit,143,1.47,210.21,0,lb,2025-06-18,1.26,1.58
19-06-2025,Giant_Store_001,1002,Orange_Navel,Fruit,200,1.29,258.72,1,lb,2025-06-19,1.26,1.58
20-06-2025,Giant_Store_001,1002,Orange_Navel,Fruit,110,1.47,161.7,0,lb,2025-06-20,1.26,1.58
21-06-2025,Giant_Store_001,1002,Orange_Navel,Fruit,173,1.29,223.79,1,lb,2025-06-21,1.21,1.58
22-06-2025,Giant_Store_001,1002,Orange_Navel,Fruit,126,1.47,185.22,0,lb,2025-06-22,1.21,0.92
23-06-2025,Giant_Store_001,1002,Orange_Navel,Fruit,160,1.47,235.2,0,lb,2025-06-23,1.21,0.92
24-06-2025,Giant_Store_001,1002,Orange_Navel,Fruit,133,1.47,195.51,0,lb,2025-06-24,1.21,0.92
25-06-2025,Giant_Store_001,1002,Orange_Navel,Fruit,151,1.47,221.97,0,lb,2025-06-25,1.29,0.92
26-06-2025,Giant_Store_001,1002,Orange_Navel,Fruit,114,1.47,167.58,0,lb,2025-06-26,1.29,1.02
27-06-2025,Giant_Store_001,1002,Orange_Navel,Fruit,112,1.47,164.64,0,lb,2025-06-27,1.29,1.02
28-06-2025,Giant_Store_001,1002,Orange_Navel,Fruit,142,1.47,208.74,0,lb,2025-06-28,1.1,1.02
29-06-2025,Giant_Store_001,1002,Orange_Navel,Fruit,148,1.47,217.56,0,lb,2025-06-29,1.1,1.02
30-06-2025,Giant_Store_001,1002,Orange_Navel,Fruit,131,1.47,192.57,0,lb,2025-06-30,1.1,1.15
07-01-2025,Giant_Store_001,1002,Orange_Navel,Fruit,128,1.47,188.16,0,lb,2025-07-01,1.13,1.15
07-02-2025,Giant_Store_001,1002,Orange_Navel,Fruit,114,1.47,167.58,0,lb,2025-07-02,1.13,1.15
07-03-2025,Giant_Store_001,1002,Orange_Navel,Fruit,108,1.47,158.76,0,lb,2025-07-03,1.13,1.15
07-04-2025,Giant_Store_001,1002,Orange_Navel,Fruit,143,1.47,210.21,0,lb,2025-07-04,1.13,1.66
07-05-2025,Giant_Store_001,1002,Orange_Navel,Fruit,98,1.47,144.06,0,lb,2025-07-05,1.43,1.66
07-06-2025,Giant_Store_001,1002,Orange_Navel,Fruit,162,1.47,238.14,0,lb,2025-07-06,1.43,1.66
07-07-2025,Giant_Store_001,1002,Orange_Navel,Fruit,111,1.47,163.17,0,lb,2025-07-07,1.43,1.2
07-08-2025,Giant_Store_001,1002,Orange_Navel,Fruit,137,1.47,201.39,0,lb,2025-07-08,1.43,1.2
07-09-2025,Giant_Store_001,1002,Orange_Navel,Fruit,145,1.47,213.15,0,lb,2025-07-09,1.38,1.2
07-10-2025,Giant_Store_001,1002,Orange_Navel,Fruit,79,1.47,116.13,0,lb,2025-07-10,1.38,0.91
13-07-2025,Giant_Store_001,1002,Orange_Navel,Fruit,253,1.29,327.28,1,lb,2025-07-13,1.38,0.91
14-07-2025,Giant_Store_001,1002,Orange_Navel,Fruit,135,1.47,198.45,0,lb,2025-07-14,1.38,0.91
15-07-2025,Giant_Store_001,1002,Orange_Navel,Fruit,97,1.47,142.59,0,lb,2025-07-15,1.46,0.91
16-07-2025,Giant_Store_001,1002,Orange_Navel,Fruit,69,1.47,101.43,0,lb,2025-07-16,1.46,1.01
17-07-2025,Giant_Store_001,1002,Orange_Navel,Fruit,100,1.47,147.0,0,lb,2025-07-17,1.46,1.01
18-07-2025,Giant_Store_001,1002,Orange_Navel,Fruit,69,1.47,101.43,0,lb,2025-07-18,1.46,1.01
19-07-2025,Giant_Store_001,1002,Orange_Navel,Fruit,172,1.47,252.84,0,lb,2025-07-19,1.44,1.29
20-07-2025,Giant_Store_001,1002,Orange_Navel,Fruit,172,1.47,252.84,0,lb,2025-07-20,1.44,1.29
21-07-2025,Giant_Store_001,1002,Orange_Navel,Fruit,96,1.47,141.12,0,lb,2025-07-21,1.44,1.29
22-07-2025,Giant_Store_001,1002,Orange_Navel,Fruit,123,1.47,180.81,0,lb,2025-07-22,1.1,1.65
23-07-2025,Giant_Store_001,1002,Orange_Navel,Fruit,203,1.29,262.6,1,lb,2025-07-23,1.1,1.65
24-07-2025,Giant_Store_001,1002,Orange_Navel,Fruit,117,1.47,171.99,0,lb,2025-07-24,1.1,1.65
25-07-2025,Giant_Store_001,1002,Orange_Navel,Fruit,155,1.47,227.85,0,lb,2025-07-25,1.1,1.15
26-07-2025,Giant_Store_001,1002,Orange_Navel,Fruit,166,1.47,244.02,0,lb,2025-07-26,1.27,1.15
27-07-2025,Giant_Store_001,1002,Orange_Navel,Fruit,209,1.29,270.36,1,lb,2025-07-27,1.27,1.15
28-07-2025,Giant_Store_001,1002,Orange_Navel,Fruit,133,1.47,195.51,0,lb,2025-07-28,1.27,1.15
29-07-2025,Giant_Store_001,1002,Orange_Navel,Fruit,122,1.47,179.34,0,lb,2025-07-29,1.14,0.93
30-07-2025,Giant_Store_001,1002,Orange_Navel,Fruit,104,1.47,152.88,0,lb,2025-07-30,1.14,0.93
31-07-2025,Giant_Store_001,1002,Orange_Navel,Fruit,103,1.47,151.41,0,lb,2025-07-31,1.14,0.93
08-01-2025,Giant_Store_001,1002,Orange_Navel,Fruit,121,1.47,177.87,0,lb,2025-08-01,1.14,1.47
08-02-2025,Giant_Store_001,1002,Orange_Navel,Fruit,170,1.47,249.9,0,lb,2025-08-02,1.34,1.47
08-03-2025,Giant_Store_001,1002,Orange_Navel,Fruit,116,1.47,170.52,0,lb,2025-08-03,1.34,1.47
08-04-2025,Giant_Store_001,1002,Orange_Navel,Fruit,146,1.47,214.62,0,lb,2025-08-04,1.34,1.33
08-05-2025,Giant_Store_001,1002,Orange_Navel,Fruit,139,1.29,179.81,1,lb,2025-08-05,1.26,1.33
08-06-2025,Giant_Store_001,1002,Orange_Navel,Fruit,209,1.29,270.36,1,lb,2025-08-06,1.26,1.33
08-07-2025,Giant_Store_001,1002,Orange_Navel,Fruit,140,1.47,205.8,0,lb,2025-08-07,1.26,1.33
08-08-2025,Giant_Store_001,1002,Orange_Navel,Fruit,126,1.47,185.22,0,lb,2025-08-08,1.26,1.43
08-09-2025,Giant_Store_001,1002,Orange_Navel,Fruit,138,1.47,202.86,0,lb,2025-08-09,1.38,1.43
08-10-2025,Giant_Store_001,1002,Orange_Navel,Fruit,137,1.47,201.39,0,lb,2025-08-10,1.38,1.43
13-08-2025,Giant_Store_001,1002,Orange_Navel,Fruit,191,1.47,280.77,0,lb,2025-08-13,1.38,1.43
14-08-2025,Giant_Store_001,1002,Orange_Navel,Fruit,123,1.47,180.81,0,lb,2025-08-14,1.4,1.53
15-08-2025,Giant_Store_001,1002,Orange_Navel,Fruit,123,1.47,180.81,0,lb,2025-08-15,1.4,1.53
16-08-2025,Giant_Store_001,1002,Orange_Navel,Fruit,201,1.47,295.47,0,lb,2025-08-16,1.4,1.53
17-08-2025,Giant_Store_001,1002,Orange_Navel,Fruit,167,1.47,245.49,0,lb,2025-08-17,1.4,1.53
18-08-2025,Giant_Store_001,1002,Orange_Navel,Fruit,138,1.47,202.86,0,lb,2025-08-18,1.2,1.58
19-08-2025,Giant_Store_001,1002,Orange_Navel,Fruit,175,1.47,257.25,0,lb,2025-08-19,1.2,1.58
20-08-2025,Giant_Store_001,1002,Orange_Navel,Fruit,149,1.47,219.03,0,lb,2025-08-20,1.2,1.58
21-08-2025,Giant_Store_001,1002,Orange_Navel,Fruit,126,1.47,185.22,0,lb,2025-08-21,1.35,1.3
22-08-2025,Giant_Store_001,1002,Orange_Navel,Fruit,162,1.47,238.14,0,lb,2025-08-22,1.35,1.3
23-08-2025,Giant_Store_001,1002,Orange_Navel,Fruit,215,1.29,278.12,1,lb,2025-08-23,1.35,1.3
24-08-2025,Giant_Store_001,1002,Orange_Navel,Fruit,155,1.47,227.85,0,lb,2025-08-24,1.35,1.62
25-08-2025,Giant_Store_001,1002,Orange_Navel,Fruit,211,1.29,272.95,1,lb,2025-08-25,1.35,1.62
26-08-2025,Giant_Store_001,1002,Orange_Navel,Fruit,137,1.47,201.39,0,lb,2025-08-26,1.35,1.62
27-08-2025,Giant_Store_001,1002,Orange_Navel,Fruit,155,1.47,227.85,0,lb,2025-08-27,1.35,1.62
28-08-2025,Giant_Store_001,1002,Orange_Navel,Fruit,182,1.47,267.54,0,lb,2025-08-28,1.35,0.94
29-08-2025,Giant_Store_001,1002,Orange_Navel,Fruit,98,1.47,144.06,0,lb,2025-08-29,1.16,0.94
30-08-2025,Giant_Store_001,1002,Orange_Navel,Fruit,155,1.47,227.85,0,lb,2025-08-30,1.16,0.94
31-08-2025,Giant_Store_001,1002,Orange_Navel,Fruit,161,1.47,236.67,0,lb,2025-08-31,1.16,0.94
09-01-2025,Giant_Store_001,1002,Orange_Navel,Fruit,146,1.47,214.62,0,lb,2025-09-01,1.16,1.05
09-02-2025,Giant_Store_001,1002,Orange_Navel,Fruit,161,1.47,236.67,0,lb,2025-09-02,1.43,1.05
09-03-2025,Giant_Store_001,1002,Orange_Navel,Fruit,118,1.47,173.46,0,lb,2025-09-03,1.43,1.05
09-04-2025,Giant_Store_001,1002,Orange_Navel,Fruit,119,1.47,174.93,0,lb,2025-09-04,1.43,1.05
09-05-2025,Giant_Store_001,1002,Orange_Navel,Fruit,125,1.47,183.75,0,lb,2025-09-05,1.43,1.38
09-06-2025,Giant_Store_001,1002,Orange_Navel,Fruit,140,1.47,205.8,0,lb,2025-09-06,1.27,1.38
09-07-2025,Giant_Store_001,1002,Orange_Navel,Fruit,126,1.47,185.22,0,lb,2025-09-07,1.27,1.38
09-08-2025,Giant_Store_001,1002,Orange_Navel,Fruit,189,1.47,277.83,0,lb,2025-09-08,1.27,1.24
09-09-2025,Giant_Store_001,1002,Orange_Navel,Fruit,94,1.47,138.18,0,lb,2025-09-09,1.27,1.24
09-10-2025,Giant_Store_001,1002,Orange_Navel,Fruit,162,1.29,209.56,1,lb,2025-09-10,1.41,1.24
13-09-2025,Giant_Store_001,1002,Orange_Navel,Fruit,138,1.47,202.86,0,lb,2025-09-13,1.41,1.24
14-09-2025,Giant_Store_001,1002,Orange_Navel,Fruit,161,1.47,236.67,0,lb,2025-09-14,1.41,1.38
15-09-2025,Giant_Store_001,1002,Orange_Navel,Fruit,113,1.47,166.11,0,lb,2025-09-15,1.23,1.38
16-09-2025,Giant_Store_001,1002,Orange_Navel,Fruit,89,1.47,130.83,0,lb,2025-09-16,1.23,1.38
17-09-2025,Giant_Store_001,1002,Orange_Navel,Fruit,85,1.47,124.95,0,lb,2025-09-17,1.23,1.38
18-09-2025,Giant_Store_001,1002,Orange_Navel,Fruit,84,1.47,123.48,0,lb,2025-09-18,1.4,1.15
19-09-2025,Giant_Store_001,1002,Orange_Navel,Fruit,114,1.47,167.58,0,lb,2025-09-19,1.4,1.15
20-09-2025,Giant_Store_001,1002,Orange_Navel,Fruit,146,1.47,214.62,0,lb,2025-09-20,1.4,1.15
21-09-2025,Giant_Store_001,1002,Orange_Navel,Fruit,142,1.47,208.74,0,lb,2025-09-21,1.4,1.11
22-09-2025,Giant_Store_001,1002,Orange_Navel,Fruit,122,1.47,179.34,0,lb,2025-09-22,1.48,1.11
23-09-2025,Giant_Store_001,1002,Orange_Navel,Fruit,127,1.47,186.69,0,lb,2025-09-23,1.48,1.11
24-09-2025,Giant_Store_001,1002,Orange_Navel,Fruit,103,1.47,151.41,0,lb,2025-09-24,1.48,1.11
25-09-2025,Giant_Store_001,1002,Orange_Navel,Fruit,96,1.47,141.12,0,lb,2025-09-25,1.48,1.38
26-09-2025,Giant_Store_001,1002,Orange_Navel,Fruit,125,1.47,183.75,0,lb,2025-09-26,1.44,1.38
27-09-2025,Giant_Store_001,1002,Orange_Navel,Fruit,158,1.47,232.26,0,lb,2025-09-27,1.44,1.38
28-09-2025,Giant_Store_001,1002,Orange_Navel,Fruit,129,1.47,189.63,0,lb,2025-09-28,1.44,1.38
29-09-2025,Giant_Store_001,1002,Orange_Navel,Fruit,120,1.47,176.4,0,lb,2025-09-29,1.14,0.98
30-09-2025,Giant_Store_001,1002,Orange_Navel,Fruit,106,1.47,155.82,0,lb,2025-09-30,1.14,0.98
10-01-2025,Giant_Store_001,1002,Orange_Navel,Fruit,185,1.29,239.32,1,lb,2025-10-01,1.14,0.98
10-02-2025,Giant_Store_001,1002,Orange_Navel,Fruit,126,1.29,162.99,1,lb,2025-10-02,1.2,0.98
10-03-2025,Giant_Store_001,1002,Orange_Navel,Fruit,94,1.47,138.18,0,lb,2025-10-03,1.2,1.12
10-04-2025,Giant_Store_001,1002,Orange_Navel,Fruit,163,1.29,210.86,1,lb,2025-10-04,1.2,1.12
10-05-2025,Giant_Store_001,1002,Orange_Navel,Fruit,110,1.47,161.7,0,lb,2025-10-05,1.37,1.12
10-06-2025,Giant_Store_001,1002,Orange_Navel,Fruit,114,1.47,167.58,0,lb,2025-10-06,1.37,1.12
10-07-2025,Giant_Store_001,1002,Orange_Navel,Fruit,89,1.47,130.83,0,lb,2025-10-07,1.37,1.44
10-08-2025,Giant_Store_001,1002,Orange_Navel,Fruit,216,1.47,317.52,0,lb,2025-10-08,1.37,1.44
10-09-2025,Giant_Store_001,1002,Orange_Navel,Fruit,116,1.47,170.52,0,lb,2025-10-09,1.14,1.44
10-10-2025,Giant_Store_001,1002,Orange_Navel,Fruit,199,1.29,257.43,1,lb,2025-10-10,1.14,1.44
13-10-2025,Giant_Store_001,1002,Orange_Navel,Fruit,95,1.47,139.65,0,lb,2025-10-13,1.14,1.64
11-01-2025,Giant_Store_001,1002,Orange_Navel,Fruit,121,1.47,177.87,0,lb,2025-11-01,1.21,1.64
11-02-2025,Giant_Store_001,1002,Orange_Navel,Fruit,146,1.47,214.62,0,lb,2025-11-02,1.21,1.64
11-03-2025,Giant_Store_001,1002,Orange_Navel,Fruit,92,1.47,135.24,0,lb,2025-11-03,1.21,1.64
11-04-2025,Giant_Store_001,1002,Orange_Navel,Fruit,96,1.47,141.12,0,lb,2025-11-04,1.23,1.12
11-05-2025,Giant_Store_001,1002,Orange_Navel,Fruit,116,1.47,170.52,0,lb,2025-11-05,1.23,1.12
11-06-2025,Giant_Store_001,1002,Orange_Navel,Fruit,151,1.47,221.97,0,lb,2025-11-06,1.23,1.12
11-07-2025,Giant_Store_001,1002,Orange_Navel,Fruit,152,1.47,223.44,0,lb,2025-11-07,1.23,1.27
11-08-2025,Giant_Store_001,1002,Orange_Navel,Fruit,105,1.47,154.35,0,lb,2025-11-08,1.38,1.27
11-09-2025,Giant_Store_001,1002,Orange_Navel,Fruit,91,1.47,133.77,0,lb,2025-11-09,1.38,1.27
11-10-2025,Giant_Store_001,1002,Orange_Navel,Fruit,129,1.47,189.63,0,lb,2025-11-10,1.38,0.91
12-01-2025,Giant_Store_001,1002,Orange_Navel,Fruit,128,1.47,188.16,0,lb,2025-12-01,1.38,0.91
12-02-2025,Giant_Store_001,1002,Orange_Navel,Fruit,197,1.29,254.84,1,lb,2025-12-02,1.33,0.91
12-03-2025,Giant_Store_001,1002,Orange_Navel,Fruit,74,1.47,108.78,0,lb,2025-12-03,1.33,1.13
12-04-2025,Giant_Store_001,1002,Orange_Navel,Fruit,144,1.47,211.68,0,lb,2025-12-04,1.33,1.13
12-05-2025,Giant_Store_001,1002,Orange_Navel,Fruit,119,1.47,174.93,0,lb,2025-12-05,1.33,1.13
12-06-2025,Giant_Store_001,1002,Orange_Navel,Fruit,142,1.47,208.74,0,lb,2025-12-06,1.21,1.13
12-07-2025,Giant_Store_001,1002,Orange_Navel,Fruit,212,1.29,274.24,1,lb,2025-12-07,1.21,1.29
12-08-2025,Giant_Store_001,1002,Orange_Navel,Fruit,132,1.47,194.04,0,lb,2025-12-08,1.21,1.29
12-09-2025,Giant_Store_001,1002,Orange_Navel,Fruit,116,1.47,170.52,0,lb,2025-12-09,1.21,1.29
12-10-2025,Giant_Store_001,1002,Orange_Navel,Fruit,141,1.47,207.27,0,lb,2025-12-10,1.3,1.29
01-11-2024,Giant_Store_001,1003,Grapes_Red,Fruit,63,1.62,102.01,1,lb,2024-01-11,1.84,1.45
01-12-2024,Giant_Store_001,1003,Grapes_Red,Fruit,70,1.84,128.8,0,lb,2024-01-12,1.84,1.45
02-11-2024,Giant_Store_001,1003,Grapes_Red,Fruit,109,1.62,176.49,1,lb,2024-02-11,1.84,1.45
02-12-2024,Giant_Store_001,1003,Grapes_Red,Fruit,65,1.84,119.6,0,lb,2024-02-12,1.84,1.45
03-11-2024,Giant_Store_001,1003,Grapes_Red,Fruit,80,1.84,147.2,0,lb,2024-03-11,1.51,1.4
03-12-2024,Giant_Store_001,1003,Grapes_Red,Fruit,73,1.84,134.32,0,lb,2024-03-12,1.51,1.4
04-11-2024,Giant_Store_001,1003,Grapes_Red,Fruit,80,1.84,147.2,0,lb,2024-04-11,1.51,1.4
04-12-2024,Giant_Store_001,1003,Grapes_Red,Fruit,65,1.84,119.6,0,lb,2024-04-12,1.48,1.4
05-11-2024,Giant_Store_001,1003,Grapes_Red,Fruit,55,1.84,101.2,0,lb,2024-05-11,1.48,1.76
05-12-2024,Giant_Store_001,1003,Grapes_Red,Fruit,51,1.84,93.84,0,lb,2024-05-12,1.48,1.76
06-11-2024,Giant_Store_001,1003,Grapes_Red,Fruit,86,1.84,158.24,0,lb,2024-06-11,1.48,1.76
06-12-2024,Giant_Store_001,1003,Grapes_Red,Fruit,41,1.84,75.44,0,lb,2024-06-12,1.49,1.76
07-11-2024,Giant_Store_001,1003,Grapes_Red,Fruit,71,1.84,130.64,0,lb,2024-07-11,1.49,2.05
07-12-2024,Giant_Store_001,1003,Grapes_Red,Fruit,61,1.84,112.24,0,lb,2024-07-12,1.49,2.05
08-11-2024,Giant_Store_001,1003,Grapes_Red,Fruit,67,1.84,123.28,0,lb,2024-08-11,1.78,2.05
08-12-2024,Giant_Store_001,1003,Grapes_Red,Fruit,89,1.84,163.76,0,lb,2024-08-12,1.78,2.05
09-11-2024,Giant_Store_001,1003,Grapes_Red,Fruit,89,1.84,163.76,0,lb,2024-09-11,1.78,1.56
